"fk","vetName","date","note"
40,"Orie Schoen","2017-08-10 14:07:21","doloribus"
357,"Christa Hodkiewicz","2018-01-19 00:36:36","Unde sint optio aspernatur. Et minus quos repudiandae iste. Autem sit minus ut."
539,"Eldon Marquardt","2018-02-19 16:17:43","In sint aliquam expedita at."
845,"Russell Klocko","2017-12-31 23:53:32","Dignissimos ipsa odio in voluptates dolore inventore voluptatem culpa."
838,"Felix Heathcote","2018-06-10 14:17:18","In et tempora tempora et dolore non sunt qui quia. Quaerat dolor laboriosam accusamus vitae exercitationem magni natus sit excepturi. Fuga assumenda aspernatur incidunt commodi quisquam dolorum."
867,"Asia Runte","2017-11-11 14:32:25","quia"
454,"Dr. Brendon Hand","2018-07-21 20:32:35","Sit odit reiciendis dolor et est nulla."
448,"Tre Fay PhD","2017-08-19 06:30:36","Quasi praesentium eius officia dolorum aliquid neque ipsum reiciendis qui."
832,"Ms. Kylee Stokes","2018-05-29 16:12:23","sit sed nisi"
630,"Ottilie Goldner","2018-05-18 04:58:29","qui"
437,"Marianna Nolan","2017-11-23 10:24:20","sint temporibus est"
111,"Tate Wiza","2018-01-20 06:53:37","Ut id recusandae sint molestias perferendis rerum perspiciatis aut.
Error aliquam autem nostrum est quia illum blanditiis numquam.
Rerum rerum itaque consectetur consectetur recusandae.
Corrupti recusandae et maiores ipsum atque hic officiis voluptatem eligendi."
135,"Caleb Roberts DVM","2017-12-23 03:18:35","Quae optio nesciunt vitae consequuntur at aut harum. Totam est quae praesentium sit omnis ut veniam omnis. Ut eum a veniam voluptas id soluta est sint. Fuga facilis minima sit impedit aspernatur."
778,"Johnathon Bogisich","2018-06-30 21:10:02","Illum sit odio tempore et ad similique autem quibusdam. Rerum et nihil voluptas id aperiam voluptas ut itaque suscipit. Enim voluptas porro dicta cupiditate fugit ipsum modi. Ipsum sit officiis deserunt non quibusdam blanditiis ducimus vel blanditiis. Amet et consequatur enim numquam ullam rerum magnam impedit doloribus. Dolor temporibus quis illo omnis qui velit.
 Quis aut et. Expedita eveniet sapiente. Quas maiores placeat nisi qui voluptatem. Sit nihil quia eos fugit saepe consectetur itaque voluptatem.
 Aut sint corporis eius veritatis aut et. Corporis expedita eum eveniet in dolor. Aut sit suscipit fugit qui cupiditate harum. Id consequatur asperiores et et harum in aliquam. Consequatur non inventore pariatur voluptates dolorum reprehenderit. Consequuntur tempora perspiciatis magni error doloribus facilis sit."
228,"Elyse Abernathy","2018-05-01 11:55:22","Est ut mollitia consequatur ut."
336,"Mrs. Ethan Schneider","2017-11-14 02:22:53","Aspernatur quod eaque reiciendis eum nulla amet doloremque exercitationem esse. Rerum animi placeat quia rerum sit ipsam error. Quis recusandae aut est. Tenetur quasi quos et dicta ex praesentium. Dolores saepe quia placeat veritatis. Autem ad perspiciatis voluptatem explicabo.
 Quis voluptatem quibusdam voluptas ratione ut et autem qui fugit. Itaque vitae quia omnis impedit provident consequatur nam aliquam quidem. Est ipsam eligendi explicabo voluptates sunt vitae autem et.
 Qui dolor assumenda deserunt. Commodi expedita nulla. Eaque facere repellendus nisi distinctio enim rerum eveniet accusantium. Exercitationem sed quasi quaerat dicta quia in deserunt. Ipsam voluptate voluptatum quae aut maxime accusamus. Officiis fugit et dignissimos magnam."
530,"Dr. Karson Halvorson","2018-05-27 13:55:39","Error dolor omnis soluta voluptas aliquam nihil nihil."
460,"Jena Steuber","2017-12-25 21:41:36","Illo necessitatibus aliquid recusandae voluptas delectus vel.
Excepturi reiciendis aut molestiae nesciunt.
Est aut beatae dolores quia."
934,"Nestor Hartmann","2018-07-14 13:02:39","Excepturi facere facilis vitae reprehenderit corporis quibusdam fugit asperiores in. Exercitationem necessitatibus accusantium id. Vel laborum rerum esse amet eum voluptas odio dolores aut. Consequatur maxime ut maxime.
 Deserunt dolor nam similique totam. Dolores culpa aut. Iure laudantium unde ut. Officia ut rerum mollitia quia.
 Cupiditate voluptas consectetur ducimus eos tempora sequi. Aliquid molestiae voluptatem sit perspiciatis dolores sint. Ut sint non iure. Sit sunt ab autem et quibusdam est. Dignissimos error hic vero at nihil eos. Officia perferendis laudantium natus praesentium."
7,"Mrs. Colby Paucek","2017-11-13 03:51:56","Sint voluptatibus commodi in ut consequatur velit suscipit est magni. Laboriosam perferendis non ducimus tempore eveniet error provident. Ea autem nobis quisquam cupiditate dolorem officiis rerum ea vitae. Et mollitia assumenda sed cupiditate aliquam. Id quos rem id modi quis vero.
 A quod omnis rerum odio vero vitae. Ea iste minima exercitationem sint sit debitis. Omnis molestias ex animi. Voluptas ad non aliquam.
 Rem quos et cum provident. Enim deserunt accusamus tenetur deleniti sed. Beatae perferendis quos odio eos consectetur sed vel. Facilis omnis aut eius. Quisquam autem totam suscipit. Ea fugiat molestiae ea unde nisi et."
273,"Kelley Doyle","2017-11-05 11:19:56","Nobis explicabo officia.
Impedit qui dolores repudiandae incidunt ullam consequatur aut."
732,"Melyna Roberts","2018-03-29 10:01:24","Est similique maxime et quibusdam."
272,"Dariana Rutherford","2018-05-05 14:33:26","Culpa voluptas consequatur eaque facilis nulla expedita illo. Ratione non et molestiae magnam dolores dignissimos. Provident non nobis voluptas voluptatem sint. Illo porro aut. Nulla ut sunt animi."
683,"Shannon Huels","2018-03-23 17:24:47","fugiat velit voluptatum"
661,"Jaime Cassin","2018-02-08 15:35:29","Accusamus veniam a et voluptas voluptate et in qui. Laboriosam voluptatem sit. Quibusdam recusandae ratione eos sint vitae."
354,"Antonette Wunsch","2017-10-03 10:48:22","Et autem reprehenderit omnis."
59,"Margret Ullrich","2017-12-22 19:53:58","Et aut dolor vel."
310,"Don O'Hara","2018-05-04 16:58:29","Voluptatem quo itaque reprehenderit.
Ut quia asperiores rerum.
Incidunt libero nam fugiat ullam nisi laborum aut.
Quisquam ex eligendi consequuntur animi vel.
Quidem omnis dolores."
993,"Austen Kilback","2017-10-17 08:30:51","quod"
83,"Arely Kertzmann","2018-06-09 07:07:01","Beatae quaerat repellat quasi quis."
996,"Emmanuel Eichmann","2017-09-07 18:16:56","Consequatur tempore aliquid debitis assumenda quae dolor aperiam. Accusamus velit porro nostrum totam quam nihil optio adipisci. Atque aut omnis aut doloribus. Voluptas placeat debitis delectus quos.
 Repellendus et et sed. Molestiae aut sed ut quod. Non tempora quia aut qui vel explicabo alias molestiae.
 Non dolorem ut. Sit ex assumenda repellendus sed rerum voluptas ut ratione rerum. Nam quaerat dolores autem. Commodi recusandae impedit laboriosam deleniti eum dolorem. Officia et ullam maiores ducimus ducimus nihil amet suscipit consequatur."
782,"Chyna Stamm","2018-05-07 15:31:21","beatae"
890,"Jerrell Strosin","2018-01-28 05:28:00","sed"
603,"Abe Windler","2018-03-18 21:34:15","Alias deleniti molestias. Sint voluptatem odio eos qui. Eum velit aut labore. Tempora vero suscipit nihil.
 Quo hic sed. Rem assumenda corporis officia. Est rerum non corporis accusamus. Qui cum incidunt sed ut molestiae in quis dolores voluptatem. Est dolores cumque ducimus quia repellendus eos expedita natus. Eaque rerum velit voluptatem quis.
 Voluptatem nam itaque. Corrupti suscipit molestiae corrupti. Eos culpa aut eum quidem voluptas quos sed adipisci doloribus. Unde ut velit provident temporibus voluptates voluptatum est non. Mollitia aspernatur id voluptatem eius soluta. Aliquid blanditiis excepturi veniam atque dolorem a animi."
72,"Jessica Beahan IV","2018-06-21 01:16:32","Et nesciunt consequatur vel."
396,"Hillard Nitzsche","2018-07-09 09:47:07","Cupiditate dolore dolorem explicabo quia qui. Esse dolorem omnis corporis sapiente recusandae. Sequi assumenda in totam itaque. Tempora eligendi qui consequatur corporis quis."
862,"Kiel Eichmann","2017-08-29 00:35:14","molestiae culpa placeat"
827,"Magdalen Pfeffer","2017-11-03 02:15:59","et"
373,"Virgie Moore","2018-04-11 11:21:55","Numquam aut beatae aut molestias unde esse ut corporis. Adipisci excepturi vitae illum. Sit nisi dolorum quis sed necessitatibus fuga. Voluptates voluptatem at aut et reiciendis at placeat. Culpa fuga sed nihil est."
455,"William Weber","2017-10-31 04:28:36","exercitationem"
407,"Zetta Shields","2018-02-23 02:49:41","Et dicta rem omnis voluptas nihil.
Sit molestiae atque.
Molestiae unde nemo esse ut illum saepe voluptate."
214,"Americo Witting","2018-06-22 20:28:01","Vero voluptates ut libero eos. Consequuntur cum unde nemo laborum. Velit esse architecto magni illo omnis ut."
323,"Daniella Beatty","2018-03-22 13:25:50","Quas voluptates molestiae doloribus ut voluptate."
476,"Kristofer Weber","2017-08-10 17:41:11","Eius ipsa voluptate esse blanditiis dolores fuga voluptate. Dolorum sed id fugit enim provident perspiciatis. Et quibusdam harum dignissimos quis veniam officiis omnis enim minus. Non qui quibusdam sed aut nam illum non. Nam in aliquam iste quisquam soluta non praesentium."
573,"Raquel Batz","2018-04-11 15:16:05","Doloribus reiciendis quaerat pariatur sit qui earum aliquam quis dolores. Placeat qui voluptas cum repellat velit molestias earum quam."
83,"Miss Wiley Turcotte","2018-04-18 13:51:36","Est est atque voluptates voluptas reprehenderit quia voluptas rem aut."
731,"Alf Huel","2017-10-20 07:06:23","At in nisi error."
565,"Earnest Reynolds","2017-08-09 14:18:44","veritatis"
509,"Lucy O'Reilly","2018-06-04 00:05:50","Quo consequatur facilis doloribus. Soluta aut mollitia quia id explicabo. Id est odio illo sit iste officia ipsum. Quia libero quia aut."
835,"Magnolia Koch","2018-05-15 00:28:43","Rerum temporibus voluptatem."
759,"Einar Homenick","2017-12-01 22:58:24","Labore praesentium rerum. Harum nobis totam quo itaque nihil. Provident harum necessitatibus laboriosam quis adipisci minima dolores et nihil. Dolor itaque atque. Consequatur placeat quo eaque. Autem consequatur enim.
 Provident rerum mollitia officia. Rerum nisi culpa minus vel. Voluptatum aut ea ab sapiente quidem dolor. Impedit quia id provident itaque neque quia. Aut quibusdam harum eum non alias perferendis aliquam. Rerum optio tempora delectus voluptates quis ab.
 Delectus numquam quisquam ut temporibus amet. Asperiores minima mollitia odit officiis doloribus voluptatem tenetur. Vel qui porro. Ducimus voluptas debitis et voluptatem doloremque maiores omnis nulla est."
772,"Zackery Adams","2018-04-22 07:27:15","Adipisci eaque voluptatem eum optio voluptatem dignissimos maxime. Quas laudantium aut eos necessitatibus. Id error minus vel maxime magnam est ipsa."
698,"Caesar Collier","2018-04-22 08:54:09","Atque itaque dolor ab quis voluptatem fugiat. Ut odio mollitia architecto quis. Aut animi ab minima et. Totam itaque omnis praesentium quidem incidunt blanditiis.
 Eos eos deserunt voluptates eveniet in. Eum hic aliquid quam tempora aut vitae consequatur rerum est. Error facere laboriosam possimus.
 Culpa sunt est. Eum qui omnis vitae iure consectetur qui et. Qui velit quaerat hic voluptatem aut iusto."
934,"Halie Brekke","2018-07-03 11:54:25","Id ratione nemo repudiandae magni eum et libero quia reiciendis. Maxime nulla sint et laudantium sapiente. Sed eum pariatur architecto alias quia sint sint asperiores. Ullam similique rerum voluptatem quas distinctio ea. Ut deserunt eveniet. Beatae blanditiis error alias aut voluptas hic aut corporis."
249,"Alexandrea Rippin","2017-10-26 23:04:54","Tempore voluptas asperiores. Id et enim commodi fugit corporis. Facilis minima autem et voluptas placeat. Vel exercitationem magni eum animi. Quia incidunt pariatur rerum sint ut."
801,"Ursula Rogahn","2018-02-03 02:30:09","Excepturi nobis mollitia laborum earum.
Enim et cupiditate beatae nulla id sint quia.
Velit sit dolorem."
763,"Dr. Sarina Morar","2018-03-14 05:23:47","sapiente"
870,"Dr. Cade Legros","2018-06-23 17:44:44","Animi tenetur mollitia ut expedita unde incidunt. Molestiae cupiditate repellendus maiores et eos. Eaque facilis rerum libero. Incidunt quia quam in quidem hic expedita officia. Accusantium nesciunt consequatur officia eum. Veniam officiis nulla voluptatem quod quibusdam impedit assumenda explicabo tenetur.
 Quis aut voluptas qui sint delectus blanditiis et et facilis. Repellendus excepturi est enim est quo molestiae doloribus ut dicta. Quibusdam et distinctio earum nostrum impedit et. Libero et amet id natus ut. Possimus tempora beatae culpa quos enim dicta dolorem itaque cumque. Tempora quia eius accusamus hic omnis.
 Aut sint odio aliquid neque dignissimos qui veniam nisi exercitationem. Quis quis at eligendi provident aut exercitationem beatae. Eos molestias nobis aut autem ut aut. Laborum aut molestias iure vitae. Ratione inventore voluptatem voluptatem."
835,"Branson Halvorson Sr.","2017-08-31 13:14:01","Culpa reprehenderit et in voluptate. Voluptatem ut excepturi aperiam. Nam voluptas voluptas excepturi veritatis. Nemo magni qui expedita tempore necessitatibus voluptatem. Quia repellat autem ut quia atque. Reiciendis odio exercitationem veritatis."
730,"Adela Dare I","2017-09-09 15:58:08","Numquam ut rem velit. Qui est repellat ut impedit voluptates quisquam sed. Sapiente officia assumenda quibusdam assumenda facilis dignissimos provident et. Amet quas laudantium omnis voluptas quia."
792,"Kaden Reichert","2017-08-04 15:10:39","qui est et"
114,"Esperanza Medhurst Sr.","2018-01-02 16:05:59","Et ut omnis ut eos et rerum qui. Odit aperiam dolorum optio ex itaque qui ipsa aut. Fuga voluptatem et ducimus repellendus perferendis nesciunt ab quasi. Placeat beatae quas eaque labore qui perferendis fuga.
 Et quod reprehenderit culpa eum amet unde vel debitis quis. Officia et aut voluptatem. Nihil aut et dolorem sapiente distinctio.
 Voluptatem omnis ipsum omnis nam nihil. Aspernatur velit distinctio eos a ut numquam. Non perferendis voluptatem eum qui beatae. Quis doloremque aperiam impedit odit. Quia dicta et illo eaque ratione illo. Animi est sunt eaque architecto natus amet."
147,"Deontae Bins","2017-12-03 17:22:10","et"
687,"Tyrell Muller","2018-06-21 15:33:34","a"
58,"Tavares Macejkovic","2018-03-26 05:40:10","Quo enim in laborum. Nam eius id quaerat commodi qui quibusdam exercitationem illo totam. Vitae eveniet perferendis sit aut ea et molestiae nihil. Non officia dignissimos ipsam totam et vitae tempora."
67,"Frieda Murray","2018-02-25 08:50:37","Ad rerum excepturi architecto cupiditate at voluptate.
Et est aliquam.
Sunt aliquam quia quae nesciunt corporis quam qui.
At quidem molestiae sit harum perferendis sint magni."
341,"Tyrel Hettinger","2018-02-05 06:04:06","Veniam aut placeat aspernatur rerum animi unde corporis nam. Est natus commodi rerum repudiandae excepturi voluptatem dicta architecto. Ea vitae quisquam dignissimos."
302,"Armand Hickle","2018-03-22 03:11:50","dolorem porro adipisci"
249,"Jeanette Langworth Jr.","2017-08-06 03:58:07","Quis ut sit."
999,"Dante Little","2017-09-05 17:21:36","Cumque aut eligendi modi ut commodi dolore sed debitis et. At maiores dolor optio ipsam nostrum harum quo. Illum placeat accusamus quasi facere id et vel. Sit impedit consectetur eius itaque quasi. Quis possimus sequi velit illum.
 Aut laudantium consequuntur architecto ad sunt qui provident. Et libero mollitia sit sunt harum omnis provident et. Asperiores molestias et qui voluptatem aut. Temporibus aut dolore tenetur omnis dolores aut. Neque et reprehenderit eum vitae ea eligendi voluptatem sed.
 Ipsa perferendis voluptate sint sed ipsum dolore possimus nemo. Eius accusamus rerum ad minus. Iusto et ipsum reprehenderit reiciendis. Consequatur laboriosam ullam fuga quod nulla fugit aut."
634,"Bartholome Hoppe I","2017-12-22 11:54:34","Ex sunt aperiam omnis neque autem qui reiciendis. Ab id aut aut quae autem sunt dolorem."
922,"Marcelino Prohaska","2018-06-12 01:08:31","Consectetur quos ea dolorem. Atque illo non aut optio voluptatum veritatis tempora. Quos omnis animi sit recusandae et est expedita id iste. Officia assumenda ratione in ad. Odit ut aut aut accusamus. Suscipit numquam aperiam necessitatibus in dolorem voluptatem tempore voluptatem.
 Quaerat modi ut et ad provident. Similique voluptatem consequatur exercitationem dolore voluptatem aut facere. Sunt velit est ut.
 Et magni beatae iste non officia id nihil tenetur. Sed labore voluptas temporibus dolorum. Itaque beatae illum optio ipsum inventore odio. Molestiae natus veniam accusantium maxime laboriosam et eos non officiis."
360,"Hiram Nicolas","2017-09-28 19:27:03","Sequi voluptatem nihil corrupti quibusdam sapiente assumenda enim dolorem.
Et ea aspernatur doloremque.
Vitae dolorem eos nihil.
Sint in voluptate fuga iure."
102,"Lenny Dickens","2018-05-17 13:47:57","Quidem architecto iste nisi incidunt ut hic atque laudantium dolorum.
Veritatis error similique sed sit.
Necessitatibus voluptatem inventore repudiandae dicta quis ipsum exercitationem amet vel.
Cumque dolore necessitatibus et animi quas."
852,"Damian Reilly","2018-05-02 10:22:43","iusto"
805,"Imani Flatley","2017-09-29 13:55:41","voluptatem"
759,"Cayla Sanford","2018-05-04 09:38:09","Voluptatibus aut quia recusandae numquam ut expedita consequatur."
609,"Maegan Hayes MD","2017-10-27 12:50:25","Inventore incidunt cupiditate."
99,"Ferne Schaden","2018-02-01 08:11:15","quis"
580,"Hoyt Murphy","2017-08-21 07:30:11","Est ut aut sint necessitatibus.
Nihil officiis inventore quas molestias rerum officia nobis voluptas.
Voluptates id fugiat.
Nobis quod commodi ipsa sed molestiae cumque.
Molestias magnam quia recusandae ad nemo recusandae officia."
379,"Ernestine Miller","2018-03-11 19:31:25","Cumque similique quia provident nobis consequatur voluptates earum vero et. Voluptatem aut odit officia alias qui et ab. Deserunt quisquam inventore et quaerat vero non sint cum. Eveniet quia ut aliquam officiis sint sunt corrupti iure excepturi."
362,"Easton Graham","2018-01-10 01:26:55","Earum et pariatur error. Ut non aut ducimus id voluptates dolore asperiores eius. A non dolorem autem."
654,"Kiarra Turcotte III","2018-06-18 11:01:31","Sit ullam cumque sapiente voluptas ea vel. Id occaecati ipsum aut dolor eveniet est rerum est quis. Dolores optio fugiat repellat et ipsum. Rerum minus soluta voluptatem omnis maxime enim neque vitae. Deserunt quo iusto sed eos in at ut. Et dolores itaque impedit soluta maiores itaque quo.
 Dolor incidunt nobis accusamus incidunt cupiditate quae. Commodi perferendis nobis tempore non. Repellendus quia ipsa consequatur dolore. Sapiente placeat molestias sint et et. Et quia repudiandae culpa dolorem provident.
 Exercitationem perferendis eligendi voluptas voluptatem minima aut voluptates. Optio nisi cumque totam odio culpa. Dolores minus in reprehenderit omnis magni. Laborum quidem ad veritatis magni et nobis voluptatum sunt unde. Dolores similique voluptatum id cumque quo."
209,"Alden Powlowski","2017-10-03 17:02:51","aperiam"
201,"Andre Crooks","2017-11-29 06:55:08","Cumque ut qui debitis non dolorum pariatur. Aut voluptatibus placeat non aliquid qui consequatur culpa at minus. Incidunt quisquam tempore. Autem quos voluptatem et iusto. Omnis provident quo. Eaque vel velit quo voluptas quisquam mollitia tempore voluptates.
 Similique mollitia maiores et fugit omnis reprehenderit. Voluptatem dolores qui cumque. Dolores suscipit et. Quo quisquam voluptatem perferendis ut porro ad. Omnis est dicta modi autem ut.
 Consequuntur numquam officiis consectetur ut sit dolores repellat qui. Sint quo dignissimos aliquam molestiae assumenda qui. Fuga aut molestias."
521,"Marisol Wunsch","2018-03-07 20:03:38","inventore dicta ut"
366,"Lottie Mayer","2017-10-17 11:26:09","Voluptas nesciunt accusamus eligendi quam accusantium molestiae eaque. Ea quae dignissimos quaerat non quod ipsum expedita. Ipsam et illo. Non voluptas voluptatibus dolore quod. Labore voluptates laborum optio et officiis amet dicta harum repellat."
858,"Joy Simonis","2017-10-13 19:17:10","Dolor incidunt nostrum sit cupiditate nesciunt. Et facere fugiat numquam error praesentium molestiae quidem. Totam pariatur deserunt similique enim autem. Distinctio eum laborum est suscipit."
356,"Carolyne Corkery","2017-12-31 21:06:26","in"
451,"Reece Huels","2017-10-23 06:02:24","Voluptas qui sint magnam sunt dolore."
884,"Lawrence Kutch","2018-05-29 02:31:39","Maxime dolorem quas voluptatum.
Quas in eum illum natus voluptas natus voluptatibus.
Et hic in unde dolores laudantium totam perspiciatis."
405,"Iva Sporer","2017-11-19 03:45:20","Qui quam libero totam voluptates cum nulla facere ea."
427,"Davon Cummings","2018-04-17 09:22:57","Est eligendi veritatis."
756,"Mr. Sydni Farrell","2018-03-25 02:03:49","neque consequatur dolore"
733,"Frida Hermann","2017-11-09 08:03:48","Dolorum sed in aut hic laudantium sint ut. Facere adipisci similique labore. Aperiam est et dolorem consectetur soluta quod tempore. Doloribus quod qui dolores libero. Harum voluptatem dolores asperiores voluptas qui. Sit vel odio."
162,"Devon Rath","2018-02-05 13:44:40","Aperiam blanditiis quam."
396,"Bernice Steuber","2017-08-03 22:58:41","consequuntur"
160,"Ahmed Batz","2018-01-07 14:31:26","Qui praesentium itaque."
354,"Emmanuel Nicolas PhD","2017-08-21 11:18:38","Autem eius nemo eveniet deserunt ea et provident dolore qui."
196,"Dorris Runolfsson","2018-01-17 23:45:52","Assumenda dolorem et et omnis molestias. Magnam repellat eos. Qui nesciunt aliquam eius eius illo quidem quia. Voluptatum dolor possimus molestiae. Error fugiat nihil sed provident molestiae optio voluptatem libero."
829,"Shaina Heidenreich","2017-10-12 23:40:23","veritatis aliquid quas"
87,"Carlie Bode","2018-05-09 06:02:56","Voluptatibus voluptates quam ut est expedita iusto magnam magnam eligendi."
109,"Lucile Wunsch","2017-10-28 06:22:50","Deleniti vel sed voluptatibus pariatur repellat ducimus. Nesciunt aliquid eaque voluptas ad dolorum qui tenetur qui."
576,"Marlin McDermott","2017-08-28 01:29:24","Dolor voluptas qui dolores."
206,"Dr. Flavie Gerlach","2018-01-14 00:16:05","est"
939,"Zelma Gutkowski III","2017-12-11 06:09:13","Minima repellat aspernatur magnam in."
346,"Demario Jerde","2018-02-10 02:53:41","At esse ratione maxime voluptatem vitae."
368,"Ms. Maritza Jacobs","2018-03-04 17:44:20","Ea ipsam enim quibusdam exercitationem dolores at. Repellat voluptatum vitae sapiente fuga. Magnam temporibus inventore vitae nihil voluptas.
 Minus ut porro fuga ut. Repellat rerum itaque qui laborum et dolorum et. Quas quidem nam blanditiis optio. Officiis porro culpa eum. Corporis eius ad numquam. Harum perferendis autem ipsam maiores voluptatem sit sunt dolor.
 Autem occaecati quae ut aut non autem. Quia impedit sunt non in. Non minima id. Veritatis quia veniam sint."
589,"Tressie Skiles","2017-08-26 02:06:24","Modi omnis accusantium inventore consectetur quis repellendus ad molestiae esse.
Temporibus placeat quidem.
Dignissimos odit enim fuga et.
Neque facilis eaque reiciendis ab.
Odio sit repellat tempore omnis totam."
258,"Antonetta Mueller","2018-04-11 03:12:10","Magnam voluptatem consequatur aliquam iure enim quidem consequuntur voluptatem.
Minima dolores ab quidem optio laborum qui rerum.
Dolores aut eos quia voluptates et."
76,"Addie Thompson","2017-08-30 04:05:05","officia"
954,"Arne Reilly","2018-06-11 04:15:43","Necessitatibus dignissimos placeat dignissimos suscipit. Impedit praesentium dicta hic cupiditate aliquid temporibus nesciunt harum. Autem neque commodi at inventore molestiae nemo mollitia sit. Omnis accusamus in ullam quasi. Adipisci fugiat nisi.
 Neque perspiciatis voluptates sunt consequatur dolorum tempora aliquam et. Et voluptatum consequatur nobis mollitia ea vitae molestias reprehenderit commodi. Suscipit deleniti earum aliquid accusamus quo. Ea rem qui.
 Vel praesentium ea officia molestiae labore. Ea error modi sit ut iste voluptatum doloribus. Voluptate non quis vero nisi tempora placeat ea. Ea quisquam voluptates odio eius nam possimus est fugiat. Blanditiis qui asperiores."
882,"Flo Sauer","2017-08-28 10:41:40","Ipsam ratione sint sunt rerum molestiae omnis et non eaque. Et nobis quod facere voluptas ad qui. Quia deleniti aut soluta."
28,"Randi Kuhlman","2018-01-29 21:00:15","molestiae"
130,"Mike Schowalter Sr.","2018-02-05 15:25:46","Officiis nemo autem excepturi occaecati ipsa vel."
35,"Mr. Cletus Marks","2018-02-03 20:20:39","Consequatur modi autem. Libero incidunt labore neque quaerat. Rerum quod necessitatibus error fuga aut soluta. Modi non ut qui."
815,"Hunter Paucek","2017-10-07 22:31:46","Et magnam quae et aut earum."
878,"Vaughn Mueller","2018-06-12 00:36:26","Autem omnis impedit. Doloribus et magni ullam. Quos cumque nam beatae impedit. Iure dolores quas explicabo voluptatum. Sed molestias quidem animi asperiores dolor ab dolore velit. Laboriosam cupiditate maxime necessitatibus illo accusantium."
41,"Kade Mayer","2017-10-02 17:57:52","provident"
76,"Hardy Dickens","2018-02-27 04:13:15","Harum fugiat aut perspiciatis cupiditate."
892,"Leonel Koss","2017-09-19 21:14:28","adipisci magni a"
94,"Dr. Hyman Haag","2018-01-11 14:23:22","Amet dignissimos voluptatibus tempore quis tempore."
489,"Joannie Gottlieb","2018-06-15 19:16:16","Earum sit est voluptatum molestiae aut iste eos nesciunt."
945,"Enoch Bins","2018-01-08 14:28:53","Quae perferendis officiis esse amet. Exercitationem quibusdam veniam saepe et soluta et. Aut in omnis tempora numquam repellendus. Sed cum dicta ullam aut neque fuga aspernatur autem numquam. Esse vel nam eius omnis accusamus provident voluptatem.
 A quia et ab repellat provident eius voluptas. Aliquid distinctio aut aliquid similique quibusdam sapiente. Laborum velit in quis cumque doloremque consectetur enim soluta in.
 Deleniti et ullam quae mollitia quidem aut. Explicabo quaerat enim repellat labore odit adipisci. Eum eligendi nemo qui quo aut unde quia maxime. Et est tempora quo quos voluptas ipsam hic voluptatem. Eum quibusdam sequi quas consequatur modi."
