"fk","vetName","date","note"
703,"Warren Hyatt","2017-11-14 05:19:24","Laudantium voluptatem sed sed. Praesentium est vel beatae alias voluptatem. Doloremque maiores iure distinctio vel. Id rerum aut. Quod enim omnis facilis delectus deserunt.
 Aut aut suscipit sint voluptatibus necessitatibus omnis omnis itaque dicta. Necessitatibus deleniti consectetur voluptates ut cumque non velit non mollitia. Ipsum quia rerum et eveniet iste nostrum perferendis eum.
 Sit dolore porro asperiores. Architecto dicta eius. Minus vel vel numquam aliquam sed voluptatibus corporis earum. Ut officiis non quasi eos dolor minima eum. Dolorum autem illo voluptate eveniet. Aut voluptatem est culpa expedita aliquid aperiam neque autem."
713,"Cheyenne Homenick","2017-10-18 04:14:54","Dolorem et magni quia rerum. Ab quo iste et sequi rerum culpa. Et ipsum dolorem totam quos enim voluptatem nisi sequi amet. Modi qui maxime delectus velit quibusdam autem necessitatibus recusandae. Sunt explicabo omnis possimus repellendus ut. Eos consectetur dolorem."
879,"Ms. Providenci Bashirian","2018-04-22 06:58:12","Nisi qui non dignissimos."
858,"Nichole Wehner","2018-02-04 04:03:08","commodi natus aut"
58,"Deshawn Emmerich","2017-09-13 18:47:17","aut voluptate numquam"
807,"Kole Kihn IV","2018-07-24 15:59:17","Adipisci eos et. Esse ex voluptas expedita nihil quasi atque sed deleniti. Quia rerum ad ex."
375,"Bryce Hane","2017-09-06 11:42:15","non aut quaerat"
651,"Kallie Reilly","2018-01-25 10:38:49","Consectetur et dolores aliquam. Incidunt quae et minus voluptas. Sapiente debitis sapiente."
498,"Natalia Toy","2017-10-09 07:48:12","Quia et iste maxime velit."
966,"Dejah Cronin","2018-06-02 19:58:15","Et sequi voluptatibus quos eaque ipsam voluptatem corporis tempore voluptate. Iure autem est blanditiis expedita explicabo."
389,"Kane Schneider","2018-04-23 16:40:11","Omnis quidem voluptatum id ad omnis eligendi quibusdam vel nostrum. Veniam esse libero veritatis non quas asperiores iure eius. Quaerat dolorum consequatur soluta quia. Quasi sit ipsa.
 Accusantium sint vero exercitationem officiis voluptatum officia. Cumque quas occaecati velit beatae. Mollitia soluta laborum dolores est a. Ab et facilis quod sapiente consectetur laboriosam ut. Adipisci animi ea consequatur corrupti placeat ad. Consectetur natus nam culpa.
 Ut ut ab temporibus. Ea est beatae et perferendis corporis. Consequatur impedit nemo animi doloribus deleniti voluptate sed consequatur."
823,"Dallin Ebert","2017-12-06 09:11:00","fuga dolor sequi"
555,"Celia Bartell","2017-10-26 17:50:00","eum"
304,"Frederique Jenkins","2017-12-04 05:07:21","Molestiae consequatur ut deserunt labore porro tempore. Perspiciatis id natus quisquam repudiandae mollitia. Voluptate magni sed. Labore et est nemo voluptatem doloremque fugit qui. Repellat ratione et recusandae aliquid atque assumenda id."
942,"Christa Blanda","2017-11-24 12:17:23","Veniam rerum perferendis et rem voluptas corporis est porro."
280,"Miss Imogene Baumbach","2017-08-31 22:14:20","Quod esse ut vel qui sint perferendis aut.
Qui nemo nihil nam mollitia.
Aspernatur nihil possimus incidunt nesciunt quam dolorem.
Delectus et nostrum quos sapiente ut."
976,"Karolann Reinger","2017-08-30 08:42:04","Eos corrupti debitis autem. Aliquam ipsam numquam et consectetur et temporibus. In ratione debitis eos similique molestiae est repudiandae explicabo voluptatem. Quibusdam possimus autem quia reprehenderit vero nesciunt est."
66,"Mr. Velva Hauck","2017-11-07 06:05:25","provident est eos"
613,"Matilda Kilback","2018-06-06 09:56:23","Dolores est nobis et ut corporis dolorum voluptatibus earum dolor. Sint omnis molestiae quam et velit. Sunt beatae dolor repellat distinctio voluptas enim et porro est. Velit harum porro sequi dicta iste ut et. Non natus sed laboriosam aut animi iusto praesentium. Porro aut velit commodi nihil et."
873,"Lucie Medhurst","2017-11-09 20:11:17","Recusandae est non libero maxime rem. Quaerat est aliquid delectus ea saepe veritatis commodi. Velit minima molestiae illum perferendis. Qui est cupiditate deleniti ut. Nobis commodi tempore rerum error odit. Ab culpa dolor rerum.
 Quis qui consequatur necessitatibus qui repellat nesciunt rerum perferendis. Corporis aut possimus sed voluptatem incidunt illo maxime iure. Nam modi voluptate rem laudantium distinctio.
 Voluptatem doloribus consequuntur quos iusto quia ipsum tenetur. Possimus nemo temporibus minima quaerat dolor voluptas. Deserunt numquam earum beatae cumque cupiditate dolor. Et quisquam tempora expedita voluptatibus."
672,"Florida Hartmann","2017-11-15 13:07:51","Aut quod numquam blanditiis architecto. Quis consectetur et recusandae voluptatem optio. Quaerat expedita tenetur dolorem vitae enim quibusdam ducimus ut. Corrupti sunt quod vero unde vero laudantium dolorem aut tempora. Ipsa possimus sed quo et ipsa. Accusamus id possimus veritatis quae perferendis.
 Qui iusto reprehenderit vel sit qui qui qui laudantium corrupti. Sed sapiente sint vitae eos enim enim. Voluptatem impedit voluptates ratione in provident dolorem. Qui id praesentium. Necessitatibus odio eaque.
 Ullam natus ducimus est consequuntur aut non vel. Exercitationem accusamus modi aliquid iure deserunt cumque delectus molestiae. Ipsa veritatis sed. Eum quia ut non quia."
736,"Sherwood Paucek","2018-06-20 18:53:53","Eligendi illo assumenda sed ducimus sed unde veritatis corrupti.
Beatae sit vitae dolorem eos est."
50,"Lacey Sporer","2017-08-04 23:10:30","perferendis nisi similique"
270,"Myrtis Nikolaus","2018-06-21 08:26:39","Omnis nisi aut repudiandae inventore aperiam enim dolorem iusto. Ipsum neque sunt sed vero distinctio dolores et hic non. Et inventore quas soluta nulla id. Quod molestiae voluptatem optio dolorem. Et aut reprehenderit quod ipsa vero sit voluptates dolores vitae.
 Qui sapiente saepe. Rerum repudiandae sed eos laborum qui. Cumque hic atque. Qui id id rerum rerum doloribus quidem. Repellendus eos et amet et sed. Voluptas aspernatur quos facilis.
 Exercitationem molestiae ullam quia numquam fugiat. Est dignissimos quibusdam facere nihil dolorem enim non qui et. Sed facilis reiciendis similique beatae sit animi ipsum laudantium."
311,"Samara Corkery","2018-04-24 03:06:38","Non praesentium aliquam. Sit cum velit hic architecto aperiam quod consequuntur voluptas iusto. Provident possimus unde eum iusto ullam nesciunt sit. Impedit aut quasi blanditiis sunt delectus et. Porro voluptatem necessitatibus maiores et voluptas sint distinctio. Aut rerum voluptatem quam distinctio minus reiciendis totam facere et."
723,"Nettie Farrell","2018-02-07 08:32:10","Quisquam facere facilis necessitatibus. Qui in architecto voluptatem et reiciendis quia sit. Dolor dolorem eius ut nesciunt ipsa blanditiis. Aut dicta fugit et. Ad rem harum quam architecto quam est. Qui beatae neque."
84,"Julio Bednar","2018-06-01 00:33:56","ut"
905,"Araceli Daugherty","2018-05-21 01:46:09","accusantium laborum sed"
369,"Kira Kris III","2017-08-20 18:29:27","perferendis"
108,"Laury Goyette","2018-06-19 22:49:38","Non eos corrupti reiciendis impedit. Iure architecto odit vitae fugit. Et iusto et saepe sapiente sequi non. Cum nostrum ea et delectus. Voluptates amet fugiat."
650,"Nicolas Goodwin","2018-04-13 14:54:09","Ipsa vel temporibus. Et et ut nisi accusamus nihil ut molestiae. Iste quaerat assumenda commodi qui.
 Sapiente quas sunt voluptatem quia. Error fugit nihil delectus recusandae ut sapiente tempore. Ad laboriosam sunt nihil asperiores. Quae dignissimos aut optio. Quae et et doloremque. Ullam laudantium illo qui illum enim officia facere occaecati.
 Dolores sit et consequatur qui laboriosam. Velit itaque quaerat vero minima. Molestiae labore ad rerum veritatis. Ratione ea explicabo consequuntur minima. Et et totam libero recusandae in."
648,"Emmalee Hartmann DVM","2017-10-16 22:08:15","Molestias cum nobis sed placeat impedit ullam.
Quo necessitatibus qui aut quis modi hic.
A aspernatur cupiditate.
Excepturi velit laboriosam cupiditate aut sit.
Ut aut aspernatur omnis adipisci optio."
559,"Hubert Schowalter","2018-01-28 12:19:01","Nihil quam voluptatem officia error. Nisi maiores maxime voluptatem explicabo et quia vel aut. Explicabo quibusdam numquam veritatis quia ipsum iste blanditiis commodi quibusdam. Et aut sit vel veniam quia consequatur. Sapiente culpa maiores debitis sapiente vero consectetur.
 Optio officia praesentium ea mollitia consequuntur vel sed doloribus nostrum. Inventore officiis quas accusantium nemo. Odit quam doloribus quidem itaque ut.
 Ea quas sed odio. Aperiam explicabo voluptatem facilis ab ut est delectus. Vero voluptates rerum qui voluptate et incidunt repudiandae."
377,"Casper Greenholt","2017-11-09 01:49:09","Est est et alias assumenda eveniet pariatur totam maxime. Et pariatur est autem labore repellat repellendus pariatur. Voluptatem voluptatem odio sed saepe. Dolorem quis vel et maiores fugit et repellat. Est sed veniam."
405,"Trenton Beahan II","2017-12-05 11:42:28","ut odio libero"
551,"Graham Conn","2017-12-25 03:11:28","occaecati natus quia"
192,"Joanny Krajcik DDS","2018-02-17 21:26:04","Provident eos in. Eum quia consequatur nostrum aliquid ducimus. Quaerat officiis error qui rerum vel voluptatem unde et. Est doloremque nisi aut ut. Minus aperiam sed itaque corporis odio architecto eum aut voluptatem.
 Nostrum id commodi tempora quia quia nisi nam. Deserunt a et sapiente. Accusamus soluta quaerat et ullam rerum sunt tempora nesciunt a. Mollitia sint et sed impedit et sed totam odit. Beatae quas voluptas aut asperiores praesentium ratione sint consequuntur est.
 Sit similique facilis et. Velit ut beatae mollitia minus rerum suscipit quo. Itaque aut quia cum iure inventore asperiores. Enim quaerat neque suscipit doloremque sint ducimus dolores eum consectetur."
578,"Johnathan Lakin","2018-02-11 09:12:28","Fugiat vero et cum. Beatae ea dignissimos nam consequuntur inventore aut aliquam possimus beatae. Numquam ex perspiciatis unde et sapiente expedita dolor corporis sapiente. Aut atque et magni repudiandae ut. Autem a et sit ullam est. Quam beatae quis non.
 Repellendus quo sit sed sit aut tempora consequatur. Nemo quia ullam explicabo at. Qui eligendi possimus et quia accusantium.
 Ex hic qui ut maxime consequatur corporis. Non qui animi ut cumque. Quisquam quo rem quis aut. Et iste neque esse ipsum rem sapiente minima facere corporis."
487,"Candace Fadel","2018-05-23 11:04:03","soluta"
928,"Missouri Jacobi","2017-07-31 15:43:18","Et omnis asperiores quia vitae nisi perspiciatis deleniti facilis."
903,"Frieda Quigley","2018-07-17 04:47:47","maiores"
208,"Annabell Gislason","2017-12-24 07:29:05","et"
110,"Lois Metz","2017-11-24 16:21:59","est facilis sed"
947,"Miss Roman Fahey","2018-04-10 18:31:44","Iste dolorem vero. Eligendi eos reprehenderit veniam. Magnam unde illo soluta asperiores delectus quidem magni. Vitae consectetur corporis beatae et corrupti."
907,"Josh Kerluke","2018-03-20 22:36:18","Quia quia esse quo recusandae est quasi minima."
694,"Lauryn Stracke","2017-10-04 21:16:12","Asperiores eveniet laudantium nulla voluptatem nesciunt. Quasi cumque ut veritatis fugit eveniet nostrum odio. Dicta architecto consequatur earum at distinctio ea et est omnis.
 Aperiam unde voluptates aut blanditiis cupiditate atque. Expedita quae ut debitis quas tenetur consequatur consequatur. Quaerat asperiores qui qui ut officia est. Quaerat eligendi laudantium non debitis repudiandae. Dignissimos iusto soluta.
 Quod et voluptatum. Ut voluptatem a odit omnis ad omnis totam dolorem qui. Et rerum dolores nihil. Mollitia molestiae occaecati voluptatibus odio qui rerum quaerat."
620,"Cornell Davis I","2017-08-29 09:37:21","accusantium tenetur atque"
435,"Heidi Schaden","2018-01-01 19:07:14","Dolor dolorem ullam corrupti adipisci saepe est in. Sed veritatis eum dolorum et numquam animi. Minus qui omnis nam. Velit totam officiis iure ratione dolor est sit quia. Iure cumque id. Deleniti tempora alias tempore incidunt nihil aspernatur fugiat sed."
543,"Ms. Gladyce Ritchie","2017-10-24 11:47:03","Dignissimos nihil necessitatibus nobis qui magni saepe. Facilis hic cum ut mollitia. Molestiae molestias veritatis. Mollitia hic quia et aut explicabo est ipsum et. Nam est omnis optio ex sapiente doloremque dolor rerum."
594,"Taya Hills","2018-06-18 15:00:28","Aliquam quibusdam nihil tempore unde sunt eum. Ea nesciunt sed ipsum ut atque sit. Aut autem tenetur error ratione unde sed ut.
 Reiciendis cupiditate qui. Repudiandae corporis suscipit voluptas provident voluptate sint. Voluptatem voluptatibus repellendus odio ad illo dolorem.
 Cumque impedit sed corporis voluptate numquam ullam. Quia voluptatibus sed nesciunt. Qui quidem eos et eos. Exercitationem eum temporibus."
888,"Yazmin Cummings","2018-05-30 16:44:00","aut aut omnis"
306,"Britney Koepp","2018-07-13 18:26:21","nihil"
697,"Ernestine Weimann","2017-11-07 06:29:53","autem"
871,"Brooklyn Monahan","2018-07-20 19:37:00","quasi"
828,"Mckayla Braun","2018-06-05 00:30:14","Mollitia similique doloribus voluptatibus ratione alias optio vitae cum sunt. Id cumque exercitationem architecto beatae et voluptate quia quasi quibusdam. Debitis adipisci error autem. Eos ut dolores dolorem quibusdam cumque pariatur rerum suscipit autem. Quos eum tenetur officiis praesentium eos. Cupiditate culpa non sint."
429,"Jack Kunde","2017-12-01 21:56:12","at consequatur facere"
994,"Mr. Stone Moore","2017-09-04 07:20:11","Fuga delectus ea quis assumenda temporibus. Et quidem omnis. Est velit earum.
 Accusamus doloribus necessitatibus voluptatem consequatur amet necessitatibus nisi ea est. Laudantium repellendus et quibusdam facilis alias. Ea voluptatem sed temporibus doloribus voluptatem aut et omnis. Sit quo possimus magnam corporis hic nesciunt optio. Minima perferendis sed voluptatem sit vero sed.
 Sint fuga ut neque molestias. Voluptatem alias fugit sit deleniti ea quibusdam nisi. Et nulla eum aut aspernatur ipsam accusamus nulla. Consectetur error quas incidunt."
255,"Ignacio Klocko","2017-10-22 06:06:05","Nam voluptates error quia quae ut velit sed sunt est. Aut nobis totam sit natus. Nam nam quia iusto. In placeat molestiae libero qui laborum.
 Recusandae non temporibus in dignissimos magnam nobis et facilis. Sed minima aperiam assumenda maiores rem vel. Sit exercitationem quos labore sed earum animi ipsa nihil est. Rem qui voluptatibus assumenda dolor dolorem est nostrum.
 Voluptates voluptatibus excepturi nulla et nihil non provident. At eos fugiat tenetur exercitationem enim officia blanditiis accusamus. Qui omnis et velit aut possimus."
357,"Miss Jayce Wolf","2017-12-26 10:02:26","Qui omnis consectetur rerum et sapiente quia. Sequi architecto pariatur eius quae dolorem voluptatem voluptatem. Ut accusamus nobis voluptatum voluptates et. Asperiores accusamus autem maiores quidem vel enim asperiores. Quibusdam minima doloremque qui asperiores voluptate facere debitis commodi."
101,"Pansy Cremin","2017-10-03 23:32:41","Laborum quidem animi suscipit sequi ab necessitatibus."
136,"Katelin Batz","2018-04-03 21:13:33","ducimus"
96,"Alexandrea Adams","2018-03-31 14:07:20","aliquam rerum nemo"
171,"Obie Zulauf","2018-03-13 08:52:02","sunt sed voluptate"
765,"Camron Bernier","2017-12-05 06:10:05","Voluptatem accusamus quia quae voluptatum numquam ducimus nihil temporibus. Nemo dolor repellat ut explicabo. Sit nihil ut dolor dolorem optio pariatur."
347,"Cody Hane","2017-10-15 16:29:43","amet atque itaque"
191,"Melany Bogisich I","2017-11-09 02:53:16","suscipit adipisci rerum"
846,"Jessy O'Reilly","2017-08-28 04:08:18","Rerum dicta commodi esse possimus voluptatem qui beatae qui optio."
546,"Ali Considine III","2018-05-13 20:49:31","Officia et aut consequatur sunt ratione laudantium.
Non nemo pariatur recusandae nesciunt quia harum numquam facere laborum.
Illum ea esse.
Ipsam laborum ipsum."
949,"Mrs. Hubert Braun","2018-06-20 01:17:24","ipsum"
331,"Gerda Kub","2018-03-17 11:52:33","aliquam"
914,"Jaclyn Erdman","2018-01-17 13:09:47","Necessitatibus ipsam aspernatur. Quia aut enim a provident repudiandae eius voluptatem earum voluptate. Nesciunt consequatur consectetur quae. Fugit quia quae placeat reiciendis ut voluptatem culpa rem nostrum."
308,"Braulio Boehm","2017-10-10 06:28:22","Non ratione autem."
557,"Eldridge Cremin","2018-03-16 03:47:12","Debitis voluptatem in. Suscipit nesciunt consequatur. Est nam voluptate. Aliquam architecto dolores voluptas sed ea doloremque quos."
964,"Benny Rutherford","2017-10-21 10:17:03","officia qui accusamus"
85,"Ms. Reuben Conroy","2018-01-13 10:27:53","totam non ut"
276,"Madeline Reilly","2018-02-04 11:06:30","Et error sequi occaecati sit nihil fuga quas ipsam."
889,"Vivien Dickinson","2018-06-08 09:28:13","Qui non molestias et expedita asperiores possimus dignissimos.
Id nam velit assumenda magni blanditiis consequatur.
Tenetur laudantium et modi pariatur iure atque odio quia.
Enim aut autem sit qui exercitationem nihil qui molestiae qui."
553,"Brycen Schamberger","2018-03-05 21:46:42","Quidem in et reiciendis voluptates quis maiores.
Magni rerum eveniet debitis totam possimus odio est ut dolores."
178,"Darron Kihn","2018-02-14 03:55:16","Animi dolor beatae voluptas perspiciatis et.
Qui perferendis maiores aut corporis exercitationem."
420,"Angus Turcotte","2017-08-02 00:34:04","iure rerum adipisci"
995,"Hilda Langosh","2018-07-19 13:38:51","Perspiciatis aliquam aperiam molestiae iste suscipit magni provident."
259,"Judge Romaguera","2018-06-15 12:20:09","Libero esse eligendi repellendus.
Nemo totam rerum est mollitia."
38,"Wilburn Runolfsdottir","2018-01-16 08:53:13","occaecati nam sapiente"
254,"Shawna Brakus","2018-02-13 00:36:36","neque"
618,"Shaylee Leannon PhD","2017-08-10 21:26:58","Voluptatem vel quam mollitia ipsum ut repellendus ipsa."
754,"Mittie Schoen","2017-10-01 15:01:27","Labore quod et non assumenda. Qui hic repudiandae. Consequatur quod molestiae nesciunt est et. Error dolor optio eius quam iste aut. Consequatur sit qui et minima qui ad quis sunt nobis."
906,"Mrs. Noemie Kub","2018-02-17 20:29:37","Beatae aut ad iste quidem. Id distinctio recusandae voluptatem quia voluptatum accusamus distinctio. Tempora dignissimos totam quis. Possimus sint magni.
 In incidunt quia asperiores officia. Accusantium expedita nobis suscipit non laudantium delectus sed delectus qui. Sunt magni fuga rem iure totam autem.
 Occaecati sunt ab eaque. Tempore libero quo. Dolorem qui dolor unde. Et consequatur quia repellendus id sunt laborum. Possimus dolorem quidem commodi. Impedit provident sint voluptas est libero fuga non."
700,"Maybelle Hamill","2018-01-04 08:20:33","Omnis molestiae molestiae dolores illo aut. Molestias ducimus officia quod ullam neque. Aut maiores et. Ut laudantium eos voluptas consequuntur modi neque quisquam."
765,"Mitchell Waters","2018-06-14 11:58:07","Accusantium recusandae architecto corrupti optio amet ea."
537,"Morton Harber","2018-06-11 02:58:36","quia qui quia"
573,"Pearline Labadie","2017-12-04 22:29:57","Qui dolore explicabo id nihil sed voluptas aut labore harum. Mollitia tempora fugiat. Quae fugit voluptates repellat nihil velit. Doloribus rerum fugiat voluptas. Sit non suscipit."
274,"Mrs. Daniella Gerhold","2017-08-26 03:45:09","Odio asperiores sunt rerum labore tempora quo illum."
414,"Brycen Jones DVM","2017-10-29 12:39:53","minus odio aut"
999,"Trisha Donnelly","2018-06-10 01:14:36","Laborum repellendus est."
644,"Miss Georgette Osinski","2017-09-20 22:42:05","Doloremque fugiat ut rem laudantium sunt ducimus quis quas. Ipsa et ut et. Non et repudiandae optio quia aut veritatis et quia. Animi voluptas molestias laudantium doloremque illo."
215,"Lennie Quitzon Sr.","2018-01-07 14:59:50","pariatur"
103,"Wyman Bauch","2018-01-19 12:59:57","Est nostrum ut est commodi est fuga veniam architecto culpa."
165,"Toney Schultz","2018-01-15 05:24:35","Cupiditate aut sit eum iusto saepe velit optio.
Commodi dolore odit.
Est dolorem sit eos asperiores eaque voluptatem sed est est."
665,"Narciso Johnson","2018-07-10 14:13:00","Consequatur hic iusto. Alias deserunt error."
892,"Concepcion Reichert","2018-02-02 19:54:10","ut"
894,"Savanah Blanda","2017-12-28 00:53:12","vitae"
943,"Miss Clotilde D'Amore","2018-03-01 16:03:13","nisi ipsum quod"
225,"Ms. Junius Mayer","2018-05-21 16:49:56","Dolorem eaque itaque eaque non sint omnis sed qui voluptatem."
515,"Willa Robel III","2018-05-18 15:17:42","dolorem libero quidem"
981,"Robyn Schaefer","2017-10-03 04:15:19","Qui ipsum excepturi ex autem et sit magnam. Quia aut dolorum qui quos ut ab illo excepturi. Autem autem dolorem omnis quis.
 Vel earum natus. Ea blanditiis excepturi earum quibusdam dignissimos quidem alias. Qui ut ducimus libero. Eos rem earum autem minima dolore qui deserunt ut itaque. Similique sequi tenetur non commodi. Laborum necessitatibus numquam et quisquam ea eum beatae.
 Et impedit sit. Rerum ex consequatur et nesciunt fuga ut sequi temporibus voluptas. Nihil sunt maiores neque. Nihil sed repellendus hic ullam alias dolorum."
821,"Margarete Schmitt","2017-12-09 04:52:21","Maiores excepturi in esse esse repellendus sunt doloremque accusamus.
Non earum et ab et voluptatem.
Consequatur veritatis itaque vero inventore consequatur aut pariatur repellendus ut.
Et sunt hic velit repellendus voluptate velit minima."
697,"Wilma Mosciski IV","2018-04-18 00:12:36","Reprehenderit laudantium soluta et ad itaque.
Nihil voluptas delectus mollitia est id ea veritatis facilis.
Id ea reiciendis architecto sequi."
454,"Camren Wilkinson III","2017-12-01 10:54:57","Provident officia accusamus.
Laboriosam nesciunt id nostrum odit non dolor cum."
982,"Mandy O'Keefe","2017-07-31 02:14:22","Dolor ut et dolor dicta magnam eligendi. Quidem quia porro eveniet asperiores sunt minima inventore. Nisi possimus quo dicta voluptatibus molestias blanditiis."
986,"Rebecca Corwin","2018-02-24 23:44:38","Vel et quisquam in quibusdam et sapiente odio vel ratione. Illum ratione rerum repudiandae voluptates eaque autem. Itaque odit similique libero delectus architecto. Quibusdam inventore porro saepe est dolore odio."
565,"Velva Skiles","2018-05-02 22:22:11","asperiores"
706,"Penelope Streich","2018-05-23 10:45:44","natus"
581,"Marge Jerde","2017-09-01 18:46:10","quis"
570,"Orion Yost","2018-07-08 23:20:51","Molestias qui soluta omnis nihil et."
594,"Osvaldo Smitham","2018-04-03 12:43:54","Eligendi perferendis quae molestiae. Qui tempora eveniet quibusdam magni eaque ipsum dolorem similique. Suscipit et sed quaerat libero tempora autem id deserunt. Illo et sed saepe et enim quis tempora quo."
674,"Annetta Schamberger","2017-12-02 04:10:16","quis"
370,"Lily Witting","2018-01-17 22:24:27","Consequatur sapiente rerum alias omnis fugiat voluptate."
898,"Edwardo O'Kon","2017-08-12 07:02:35","Sint velit est vero dicta veritatis facere unde voluptas. Qui vitae fugit hic est enim qui amet facilis eveniet. Velit iste atque aperiam id eius sunt eum nihil. Temporibus sit quae delectus aut ipsam autem totam necessitatibus. Qui consequuntur quaerat quis hic rem quod possimus. Harum illum aut doloremque a corrupti nesciunt rem nam."
532,"Aida Terry IV","2018-03-05 21:25:31","Est unde reiciendis aperiam dolorum nesciunt quis repellat.
At et minima dolores distinctio voluptatum aperiam quia."
627,"Crawford Bernhard","2017-11-02 23:07:23","cum"
816,"Summer Kilback","2018-05-22 01:36:39","Nisi eos quis."
684,"Reid Mraz","2017-10-19 18:24:04","reprehenderit quam minus"
258,"Eriberto Toy PhD","2017-12-26 21:54:49","Doloremque illum minus incidunt est reprehenderit qui qui nihil. Non sint vel asperiores ex dolorem aperiam molestiae. Cum et minima saepe nesciunt vero qui repudiandae at quisquam. Rerum sequi qui harum commodi repellat ab eaque."
949,"Orlando Waelchi","2017-12-15 05:17:09","atque perferendis voluptatem"
258,"Mrs. Kaylin Goodwin","2018-03-24 00:17:09","Voluptate a eos qui eos doloribus saepe libero eligendi sint. Iure sit dolor sunt nostrum nostrum quisquam est beatae incidunt. Quod aut quas enim ipsum. Repellat velit veritatis. Quod vel et accusantium ab iste consequatur. Beatae eum fuga quisquam vero occaecati quos."
41,"Maryam Ferry","2017-08-17 23:40:24","magnam optio quis"
777,"Miss Aaron Flatley","2018-05-17 14:57:59","Delectus dolores repudiandae et totam. Exercitationem error placeat necessitatibus et sit ea at. Aut sit voluptatem placeat et."
252,"Elwin Schuster","2017-11-13 02:39:16","ea"
881,"Heaven Homenick","2018-01-11 04:56:45","repellat facilis aliquid"
841,"Ignacio Dare","2018-04-07 10:06:54","Quo necessitatibus ut laboriosam enim modi.
Et qui quibusdam cumque modi rerum praesentium non quidem.
Dignissimos alias tempore ab enim commodi est omnis totam explicabo.
Ut odit autem.
Labore est non mollitia sed aut minima sed amet."
823,"Maybell Jakubowski","2018-02-04 19:31:40","dolores"
973,"Makenzie Kunze MD","2017-08-11 09:41:07","Aut explicabo aspernatur excepturi hic eum molestiae fuga molestiae.
Saepe expedita deleniti eius iusto numquam praesentium dolores.
Quasi perspiciatis nulla et."
483,"Raymundo Hoeger","2018-05-13 11:51:43","Eum qui vitae fugiat voluptates illo non esse ad magni. Natus molestiae neque ullam doloremque possimus corrupti. Praesentium deserunt qui velit et delectus rerum ad nisi."
727,"Adriel Lind","2018-07-08 10:15:14","Et aut et omnis voluptatem. Inventore libero quos ullam doloribus veritatis et et. Fugit rerum alias et expedita debitis. Voluptas voluptates quisquam voluptatem. Dolor dolores qui unde. Debitis accusamus suscipit."
646,"Barney Mante","2018-06-05 13:48:33","deserunt aut voluptatem"
144,"Torrey Stracke","2018-02-28 04:23:27","Id exercitationem totam totam eius voluptatibus."
