"fk","vetName","date","note"
36,"Ms. Audrey Schoen","2018-03-17 08:52:54","Animi quia rerum nesciunt velit. Et fugiat necessitatibus voluptatem officia. Ipsum aspernatur enim rerum est. Distinctio omnis est provident."
89,"Enoch Shields","2018-02-01 20:09:11","Minus unde hic pariatur eligendi. Sint enim earum aut incidunt velit. Error sed autem aperiam deleniti libero architecto voluptas minima et. Dolor ea modi eos. Fuga est omnis repudiandae.
 Incidunt atque perferendis excepturi voluptatem iure possimus illum voluptatem. Expedita sit praesentium. Et et perferendis labore aut. Quis omnis ipsum distinctio similique deleniti.
 Molestiae reprehenderit et minima alias sit. Possimus ut consequatur maiores vel. Iure cum debitis hic veritatis quisquam aut excepturi. Minus iste aut molestiae et. Voluptatem eius et esse rerum."
475,"Charlie Howe","2018-06-06 05:44:02","Voluptatem ullam aspernatur et dolore et nostrum. Assumenda fugit sit dolore sit eum temporibus. A nesciunt officiis esse maxime laborum sit similique reprehenderit. Minus unde ipsam aut qui quidem. Eum voluptate sequi debitis omnis. Repudiandae quae maiores voluptatem.
 Corrupti minus temporibus aut occaecati. Fuga reiciendis cum aut nobis. Voluptas incidunt officiis quis. Officiis placeat enim at nobis cupiditate iusto voluptas tempora. Asperiores minima dolor et consectetur. Maiores voluptate asperiores incidunt non.
 Optio ut et alias aut. Non perspiciatis blanditiis. In dolor dolores omnis doloribus sequi in ad consequatur consequatur. Et et magnam consequatur eius repudiandae autem et. Doloribus quaerat non et nesciunt. Deserunt neque fuga ab cupiditate qui explicabo."
801,"Aliza Gleason","2017-12-19 14:59:50","Ut et magnam. Enim rem quam voluptate ipsum. Veritatis eligendi quos harum sequi saepe quo a placeat. Harum labore assumenda dicta quibusdam. Explicabo sed expedita adipisci molestiae facilis earum."
480,"Avis Jakubowski","2017-10-10 12:55:17","est"
913,"Keagan Wilderman","2018-04-30 13:49:16","Quia consequatur doloremque consequatur error doloremque natus similique alias voluptate. Magni non rerum. Voluptatem cum et recusandae ut.
 In temporibus totam est perferendis sed qui veniam fugiat. Nulla est quis eveniet quisquam quidem. Porro dolorem esse adipisci nihil fuga praesentium. A odit officia praesentium quo laudantium sequi rerum minus. Facilis asperiores tempore nostrum.
 Ut voluptate temporibus repudiandae similique quasi quo fuga mollitia enim. Beatae enim corporis officiis culpa sit incidunt. Illo ut ratione laboriosam atque ut et. Ab ab odit placeat."
75,"Anissa Parisian","2018-03-10 12:36:16","Sint non voluptatem sint quo et omnis.
Laboriosam qui in rerum quae.
Libero voluptatem repellat voluptatem tempore veniam.
Officiis explicabo dolorem qui minus."
133,"Gage Moen","2017-12-24 09:44:30","Assumenda tempore culpa et aspernatur sapiente facilis voluptas. Dignissimos praesentium quaerat necessitatibus voluptas ea. Vel ipsa modi.
 Veritatis excepturi incidunt sed ducimus eveniet praesentium voluptatibus labore voluptate. Velit velit ex et aut earum. Tempora beatae dignissimos perspiciatis velit ut fuga.
 Qui repellat est autem nostrum accusamus. Suscipit adipisci eos in occaecati aperiam quia repudiandae aut. Facere nobis iure autem eum omnis. Ea rerum animi. Non fugiat non delectus consequuntur aut. Quia et architecto."
891,"Kendrick Bins III","2018-05-26 07:54:26","Fugit esse id sed aut quo et odio facere."
327,"Mrs. Jeanne DuBuque","2018-07-05 01:42:11","molestias labore vitae"
245,"Dr. Aylin Lehner","2018-03-17 04:37:40","Reiciendis dicta reiciendis facere sed est. Sit omnis atque dolorem possimus sed pariatur accusantium atque hic. Eum et maiores accusamus aut sed perferendis quia et est. Hic iure voluptas quae tempora voluptas. Soluta tempore pariatur officia harum autem sed fugit assumenda."
841,"Juliana Stracke","2018-03-04 09:03:01","Et nostrum rerum possimus excepturi inventore sequi pariatur."
261,"Russel Batz","2018-01-25 17:00:51","repellendus quisquam cupiditate"
118,"Carlos Paucek","2017-10-29 17:19:02","Ab tempore perferendis fuga quos facilis nemo labore ipsum. Adipisci quos et magni quam tempora. Ut laudantium odio non. Nemo dolores sit ipsam consequatur. Neque ducimus enim temporibus ipsa voluptatum. Ipsa odio ipsum quia nulla."
726,"Dr. Leora Kub","2018-06-18 02:59:20","Incidunt non natus alias est enim sunt voluptates repellat incidunt."
543,"Sierra Kilback","2017-11-14 23:42:18","magnam similique dolore"
644,"Mr. Taurean Langworth","2017-08-24 21:36:10","Sint eum voluptas magnam aut sequi sit.
Esse ut dolor corrupti voluptates facilis ab veritatis harum."
291,"Jacynthe Mante","2018-04-04 10:08:45","Repellat molestiae provident aliquid corrupti delectus velit dicta."
755,"August Aufderhar","2017-12-22 13:13:13","In id optio nostrum explicabo architecto dolor sed commodi. Perferendis amet incidunt consequatur quas sit aut recusandae aliquid. Odit a qui ipsum perspiciatis beatae. Id optio id ipsam fuga est deleniti saepe.
 Reiciendis magnam error qui hic ea. Sed sed omnis culpa eos odio vel aut velit qui. Nobis consequatur fugit suscipit. At ea provident aut odit.
 Enim maiores rerum illo sunt quae earum qui voluptas nisi. Ullam maiores corporis sapiente perspiciatis. In consequatur illum eius est eum qui quas qui. Animi rerum esse iusto rem et quas quis autem. Quia nisi sed illum hic quod maxime. Aspernatur odio suscipit labore consequuntur exercitationem tempora sed explicabo illum."
325,"Sidney Crist","2017-11-25 17:51:21","Quam veritatis nihil expedita repudiandae eos ipsam."
807,"Kenny Berge","2018-04-01 22:10:59","Assumenda cum facilis omnis."
775,"Garret Dare","2018-03-25 17:41:14","Possimus perferendis et distinctio sed quae tempore qui placeat. Modi voluptas autem tempore rerum quia explicabo. Autem et ullam perspiciatis eos. Vel non recusandae aut porro est sed at. Laborum magnam rem repellat delectus aliquid sint aut."
490,"Gene Klocko","2017-08-10 23:42:16","minus"
845,"Miss Leopold Wolf","2018-07-26 19:02:19","voluptatem ut illo"
529,"Tevin Hegmann","2018-01-17 07:40:26","Blanditiis praesentium dolores voluptas reprehenderit iusto in. Illum ut consequatur. Et cupiditate sunt perferendis eius ex architecto nesciunt. Vero ut fuga quis qui. Quidem dolorem sit eaque ut adipisci alias sit fugit. Ad ipsam quia."
42,"Kaia Grant","2017-08-17 11:51:34","Eos pariatur at harum culpa ducimus. Officia debitis ipsa inventore error sunt et eius accusantium dolorem. Sunt voluptate culpa nesciunt mollitia quis corrupti quis beatae reprehenderit.
 Minima et sit et aut est. Quia perspiciatis dolores atque doloribus dolor voluptatibus. Vel rem error modi impedit. Amet fugit maiores amet est et eligendi.
 Laudantium nobis aut aut sunt aut at quas eos cupiditate. Qui enim animi ducimus. Et voluptate autem laudantium fugiat. Iusto quia totam eligendi iure quas est."
340,"Mrs. August Rutherford","2017-11-11 05:30:02","Modi perferendis rerum error ducimus accusantium sunt.
Animi est voluptas."
963,"Ms. Halie Casper","2018-04-27 01:10:52","Ullam tempora aut quia eos rerum repudiandae assumenda accusantium aliquam.
Consequatur ea dolorem.
Temporibus dicta aliquid laudantium cumque fuga distinctio sit.
Ea dolorem molestias quia accusantium."
822,"Oceane Howell","2017-09-13 21:17:02","eum"
675,"Andreanne Ernser","2018-07-02 13:53:58","Placeat mollitia ut quos rem."
235,"Miss Idella Powlowski","2018-02-19 08:13:04","Voluptas labore sint quae numquam ut assumenda ipsa aliquid. Veritatis sit ipsum quod. Illum sint voluptatum sunt voluptatem velit quod. Tempore praesentium perspiciatis cupiditate voluptatibus ex velit. Laborum non cum facilis."
565,"Fae Frami","2018-07-24 11:28:01","Et eius alias exercitationem libero. Deleniti assumenda nesciunt deleniti alias excepturi. At possimus pariatur harum quam at soluta natus dolor quo. Distinctio illo minus architecto voluptatem possimus autem consequatur repellat."
519,"Mrs. Loyal Barton","2018-05-03 11:49:33","In totam in minima eum repudiandae blanditiis maiores minima qui. Aut pariatur ea sunt aut sed quis qui. Qui velit et molestiae dolorem perferendis veritatis qui labore. Nobis in et debitis vitae illo. Quia delectus nobis."
978,"Mrs. Peyton Reinger","2017-08-30 13:51:15","Maiores similique rerum autem."
815,"Arlie Strosin DDS","2018-04-20 18:17:59","ut"
142,"Raina Padberg","2017-08-26 15:25:29","Voluptas rem nihil ullam omnis. Et aut distinctio sint amet assumenda suscipit. Facilis magnam et ipsam culpa dicta vel qui ratione. Ipsa excepturi corrupti illo dignissimos consectetur est suscipit perferendis. Nihil dolorum cumque et aspernatur repudiandae quia. Praesentium sed est ea cumque ut eaque expedita aspernatur."
345,"Cooper McDermott Jr.","2017-11-07 11:40:36","Minima voluptatem aut asperiores consequatur."
265,"Anne Wuckert","2018-07-04 23:35:14","ducimus voluptatum incidunt"
610,"Ozella Kuhlman","2018-02-11 08:49:05","repellat dolore quisquam"
353,"Cade Nienow","2018-02-23 00:59:26","Velit delectus et quidem necessitatibus quia."
615,"Oscar Conroy","2018-03-21 17:40:51","Ea atque eius incidunt esse ut et adipisci quia."
382,"Rosamond Ryan","2018-05-24 07:46:05","Id sunt explicabo est mollitia. Ut pariatur at asperiores quas distinctio. Dolor officiis nobis natus ut officiis."
697,"Terrill Buckridge","2018-03-16 12:13:47","Nihil quibusdam eum aut dolor similique."
416,"Marcelo Reichert","2017-10-29 12:35:39","Repellendus vel sint. Quo excepturi eum tempore voluptas aliquam dolores inventore. Est maxime animi ut in ut eum blanditiis sit inventore. Sit nihil libero voluptatibus numquam eius. Molestiae quis dolor voluptatum quam omnis."
263,"Makenzie Conn","2017-09-14 03:40:16","Animi omnis rerum eum nisi est sunt neque voluptatem asperiores. Soluta rerum est ut inventore occaecati consequatur quia qui soluta. Porro quia magni. Iure fugiat id in velit dolor omnis aspernatur doloremque porro. Voluptatibus labore ut aut omnis ut hic modi error. Laboriosam architecto non quas."
838,"Irwin Langworth","2018-02-13 09:29:21","eos"
294,"Lexie Kemmer","2017-08-17 02:11:58","itaque"
332,"Dr. Brandon Koss","2017-09-13 00:23:03","Ad quisquam consequatur dignissimos iste aut mollitia est maiores. Vel quo accusamus ut. Officiis ad aliquam quo et est omnis ut rerum rerum."
489,"Tristian Trantow DDS","2017-11-24 01:08:26","est"
372,"Zelda Hegmann","2018-01-12 23:10:10","Illum voluptas tempora harum ducimus sit et placeat non sit. Blanditiis recusandae suscipit rem. Atque ratione in ut in itaque ex.
 Odio eos ut quidem rem libero corrupti. Consectetur occaecati ratione. Explicabo voluptatibus ut voluptatem architecto et eligendi et non expedita.
 Qui sed eaque consequatur perspiciatis praesentium. Ad eaque iure itaque ratione facere sed est ipsam. In quisquam veritatis doloremque debitis. Est corporis nesciunt maiores deserunt incidunt maxime vel et quo. Eligendi eos eos quibusdam rerum ullam minima laborum voluptates."
452,"Maxime Weber","2018-01-30 05:54:30","occaecati adipisci sequi"
996,"Priscilla Trantow","2018-07-24 15:28:01","Qui facilis molestias. Explicabo qui dicta saepe nostrum qui id saepe temporibus et. Et cumque perspiciatis quia dolores et repellendus laborum. Asperiores eos ut sit voluptatem quam soluta architecto dolorum. Fuga aut vitae praesentium ullam. Esse atque nihil omnis."
678,"Osborne Ferry PhD","2018-03-04 04:27:33","Et eum itaque soluta assumenda occaecati unde quia est id. Magni et dolores neque odit autem nostrum necessitatibus debitis. Ullam voluptatem quidem quia enim. Mollitia rerum dolorum."
498,"Alexandre Boyle","2017-09-01 21:57:25","voluptatem"
974,"Houston Bartell","2018-03-07 07:35:59","Commodi necessitatibus explicabo."
490,"Carson Schmeler","2018-03-29 14:43:51","Eligendi corrupti asperiores in a et aut culpa. Dolores et facilis aut laudantium qui ipsa consequatur mollitia. Qui iure in voluptates aut."
484,"Justus Jacobs","2018-04-05 16:36:47","Quasi at porro voluptas iusto odio laudantium omnis sed odio."
909,"Jamie Predovic","2018-07-20 00:37:19","Esse voluptate fugiat sed pariatur.
Odit nemo doloremque molestiae occaecati temporibus est.
Rerum vero consectetur sint temporibus consequatur sint et eius et.
Qui sunt et quo sit delectus vitae."
682,"Shanie Wehner","2018-05-10 13:19:16","Doloribus vero et hic eligendi minus vero provident autem quibusdam. Aliquam assumenda iste animi id. Est voluptas et voluptas deserunt eos quaerat. Quis eos earum facilis enim. Sunt suscipit laborum aperiam accusamus quam deleniti nemo vitae. Similique qui ut assumenda non consequatur sed."
38,"Junius Renner","2017-08-29 01:33:15","Soluta quidem similique fugit cum ratione autem. Deleniti labore perferendis necessitatibus repellendus nisi. Rerum necessitatibus exercitationem doloribus. Molestias unde fugiat labore. Aliquid qui quia. Dolorem saepe minima.
 Impedit commodi commodi veniam enim. Excepturi officiis quam et corporis. Iure beatae quis commodi minima quidem expedita. Ex aut magnam in molestias neque eos recusandae est quae. Quaerat harum et repellat aut quae. Explicabo nobis fugit nesciunt nostrum.
 Quas voluptatum eaque aut. Aut quia dolorum non consequuntur dolore molestias. Voluptatem quia nostrum sed."
914,"Kailey Osinski","2018-02-10 18:52:15","Qui quo est iure quia ipsa sed et. Incidunt reiciendis quae rerum ut adipisci est quo quo qui. Incidunt aut aut vitae iure veritatis consectetur aut sit. Ea et dolorem soluta pariatur et non sed deserunt. Autem consectetur ipsum voluptatum."
698,"Cindy Mohr","2018-03-03 13:44:30","Amet rerum est officia repellendus. Sit sapiente corrupti. Minus nulla nobis dolor. Tenetur animi accusamus perferendis aspernatur quas. Et et eum.
 Ipsam corporis nam provident dignissimos. Soluta veniam ab aperiam ut eum non. Aspernatur veniam laboriosam.
 Qui at velit iste tempore culpa est accusantium dolorum neque. Nam sed iste eaque corrupti enim in ullam. Rerum aliquid aperiam provident. Ut assumenda quo quia laudantium repellendus voluptates sunt sed."
144,"Lowell Zulauf","2017-12-10 21:37:34","qui"
735,"Rahul Simonis","2018-07-11 12:03:40","Molestias quibusdam iusto qui aut cum voluptatem. Nesciunt molestiae quaerat aut aperiam corporis ut. Nihil exercitationem necessitatibus odit delectus aliquid. Ea omnis magnam.
 Provident qui natus. Tempora et et quidem et. Ipsam inventore vel sequi quo ducimus quia. Repellat cum esse possimus tenetur officia. Dolore reprehenderit et saepe similique.
 Quisquam nostrum sed quo aut pariatur nam vel. Dolores soluta saepe architecto. Dicta et aut aperiam quo sit neque. Vero et beatae expedita quaerat ut qui. Tempora minima ex distinctio debitis commodi."
902,"Hipolito Fadel","2018-01-07 05:30:30","Excepturi iusto quasi rerum iste quidem sed quas aut.
Consectetur voluptatibus voluptas eum et mollitia quas.
Ab dolorum saepe dolor.
Voluptatem maxime debitis repellendus nulla ratione asperiores beatae dolores."
527,"Tavares Roob Jr.","2017-11-30 22:25:19","temporibus ea minus"
190,"Gideon Brakus","2017-11-28 10:56:20","Quod non nam inventore dignissimos vero error est totam ex."
658,"Miss Elinore Price","2017-09-13 12:22:05","Doloremque voluptatem eum assumenda repellat molestiae nulla. Quidem quisquam exercitationem ut alias. Qui sint sapiente omnis occaecati dicta mollitia excepturi natus. Qui ad reprehenderit quia optio et. Quis vitae tempora. Autem non sit."
671,"Lucio Hilll","2018-06-12 07:58:49","id neque quia"
452,"Eulah Lockman","2018-04-24 20:30:20","Aperiam id tempore distinctio atque natus tempore.
Fuga facilis alias ab aliquam voluptas et.
Cum temporibus quod aperiam placeat possimus deleniti eos.
Ut blanditiis minima neque voluptatem veritatis illo vitae itaque."
978,"Izaiah Hegmann","2018-01-07 18:03:46","Ratione quia nulla eligendi nostrum est. Quia sed dolorem debitis praesentium amet voluptates. Aliquid quasi impedit quibusdam non velit pariatur laboriosam expedita. Ut voluptate et totam in tenetur facilis."
156,"Jalen Ritchie","2017-11-16 11:26:35","distinctio"
902,"Eldon Lakin","2017-08-17 01:36:46","provident"
558,"Paige VonRueden PhD","2017-12-20 15:08:45","Id illo accusantium omnis alias unde quod.
Dignissimos ipsa rerum cum amet magnam odio deserunt enim."
408,"John Kihn","2017-12-06 11:07:09","Ratione quidem dolorum voluptatem. Excepturi qui fuga sit quo rem. Similique est placeat quia. Pariatur dicta reprehenderit officia maxime. Nulla eum iusto aut quia non unde quo omnis eum.
 Beatae dolore mollitia distinctio architecto adipisci id rem. Eligendi atque eligendi reprehenderit iure nihil quos eius quis voluptatibus. Maiores temporibus in aperiam id dolore nostrum cupiditate itaque. Est nisi repellendus ut voluptatum doloribus vero vel fugit.
 Et possimus voluptatem ducimus aliquam est ab ut. Numquam exercitationem non id. Amet culpa esse est."
569,"Adolf Runte","2018-05-24 10:42:57","atque"
445,"Laurie Champlin","2018-02-15 23:51:13","tempora dolores placeat"
124,"Joesph Ledner","2017-09-16 19:14:17","nihil nostrum corporis"
984,"Korey Lubowitz","2018-02-11 14:17:41","Tenetur nam sint rerum similique voluptatem qui.
Dolorem molestias vel ex ab iure nesciunt et sint."
736,"Maximilian Kulas","2017-10-01 05:26:32","Quo quam et et.
Tenetur eum consequatur omnis eum quibusdam.
Magni labore dolorem harum vero aut explicabo neque assumenda.
Odit iste enim libero recusandae aut voluptate."
479,"Mrs. Jake Moen","2018-04-23 13:03:46","Sed iure iste quia odit assumenda optio rem. Non qui eligendi perferendis aut incidunt molestiae voluptatibus quo non. Distinctio quidem libero qui expedita. Et id id. Maxime adipisci ab debitis. Qui sit eum laudantium corrupti eos nihil consequatur reiciendis."
512,"Mrs. Juliana King","2017-12-07 10:20:21","Maxime et nihil earum saepe. Suscipit praesentium distinctio porro quia esse. Fugiat est molestiae in. Sint est recusandae rerum ea nihil eveniet et eos. Veniam consequatur soluta. Consequatur odio mollitia eligendi ut."
962,"Shea Friesen DDS","2018-04-03 08:11:52","Enim vel et. Quis natus voluptatibus quasi voluptas. Labore et voluptatem excepturi qui.
 Magnam laudantium qui non est debitis tempore. Nisi iste possimus recusandae corporis nesciunt ab nobis. Atque provident quam est dolorem officiis delectus sed.
 Vero id molestiae. Eligendi aut odio. Officiis quidem dignissimos vero quam laborum facere voluptatibus rerum. Ducimus voluptate ea et illum non."
952,"Sigrid Corwin","2018-02-27 11:53:35","Nihil consequuntur eveniet culpa magni impedit ullam occaecati non ea. Quam qui dolorem iste aliquid reiciendis ea numquam consequatur molestiae. A quibusdam voluptatem quidem quia et maxime est aut quo."
995,"Bettye Abbott","2017-10-17 07:31:56","Autem alias explicabo. Non quis voluptatibus qui cupiditate. Ipsum facere distinctio fugit cum unde et nihil. Sit quo odit explicabo eveniet quia. Quo quasi et odit est rerum quod quisquam."
587,"Eunice Jacobi","2017-08-04 08:12:31","Reprehenderit qui voluptatem fugiat nostrum velit earum.
Eligendi magnam quam et asperiores.
Eos aperiam molestias omnis sunt repudiandae occaecati totam ut autem.
Blanditiis ratione quaerat consectetur magni quasi."
304,"Brennon Bahringer","2017-08-28 17:18:07","ullam minima aliquam"
748,"Mrs. Lavina Padberg","2018-01-15 07:41:24","et perferendis est"
223,"Helmer Quigley","2017-09-05 11:38:36","Corporis quia nostrum."
215,"Lennie Runolfsdottir","2017-08-05 02:40:56","Consectetur aut sunt. Enim sed accusamus sit rerum perferendis. Velit dolorem expedita maiores voluptatem non. Aut nam in et. Omnis voluptatibus dolore sit autem sit provident rem."
199,"Abbie Gerlach","2018-06-25 10:06:35","Quia accusantium molestiae."
410,"Monserrat Little","2017-11-24 11:21:09","corporis libero at"
807,"Ana Willms","2018-03-09 01:36:53","Voluptas alias eaque dignissimos ut quia harum sapiente sint quo."
642,"Sierra McLaughlin DDS","2017-12-17 21:38:21","Aperiam iure quaerat.
Odio dignissimos omnis.
Nisi voluptatem voluptatem qui reprehenderit officia eaque cupiditate.
Omnis sed perferendis molestiae perferendis occaecati eum tenetur molestiae."
149,"Hulda Weber","2018-01-12 23:55:26","Repellat aliquam eum hic neque temporibus sint at."
732,"Eve Thompson","2017-10-25 03:27:21","Est aut excepturi ut aut adipisci quod quae aut blanditiis.
Ut laborum sunt autem nam similique eum eveniet harum ipsa.
Vero in distinctio.
Aliquam et molestiae architecto voluptatem tempore impedit."
915,"Stevie Daniel","2018-02-28 05:55:03","Enim velit doloremque suscipit praesentium. Dolore enim quia. Sed voluptas sed assumenda debitis facere similique maxime."
78,"Ms. Cameron Roob","2017-08-07 15:53:50","In explicabo quo. Explicabo dolor magnam quasi. Sed repellendus quia repellat porro. Corporis quia aliquam sequi."
82,"Arturo Howell","2018-02-02 19:11:10","Et et consequuntur sint unde quidem consequatur numquam eum rerum. Dolore dolor minus excepturi recusandae iure quaerat. Molestias doloremque neque id ad voluptas. Deleniti ipsa nostrum vero delectus voluptate qui non laudantium. Odit asperiores quibusdam dignissimos ut quisquam perspiciatis. Sed voluptatibus eveniet ut sunt."
431,"Florence Corkery","2017-11-12 00:11:45","Minima debitis eveniet vero possimus accusantium. Nihil explicabo delectus maiores aut. Et quibusdam nihil aut ducimus est quas non officia voluptas. Quia earum beatae minima. Quae nisi nemo tempore voluptatem atque autem provident. Sed rerum quibusdam sint et ut et tenetur eius."
495,"Carolyne Mayert","2017-12-08 07:48:28","rerum"
624,"Miss Theron McKenzie","2018-05-08 19:28:19","Sed velit minima.
Corporis fugiat assumenda.
Tenetur excepturi recusandae aliquid."
308,"Jabari Considine","2018-03-17 22:33:11","enim"
330,"Hiram Wilkinson","2017-10-28 20:40:05","Temporibus voluptates iste nobis blanditiis est vel."
626,"Ms. Marielle Mills","2017-12-09 16:41:24","Amet reprehenderit quis."
177,"Quentin O'Reilly","2017-10-02 21:54:07","Est temporibus consectetur. Expedita culpa error eveniet blanditiis voluptate vel. Eos et et velit inventore nobis eligendi et expedita corrupti. Beatae omnis fugiat. Laboriosam a voluptas quas fugiat illo veniam."
7,"Will Reichert","2018-04-05 22:57:58","Doloremque reiciendis sunt.
Molestiae exercitationem esse magnam dignissimos a autem fugiat qui.
Nulla quia est.
Explicabo similique est et blanditiis libero sit asperiores illum.
Veritatis excepturi corporis sint consequatur aliquam quia inventore eum dolore."
194,"Sherwood Fadel","2018-05-11 12:18:29","voluptas"
559,"Emory Wyman","2017-07-29 12:32:02","nulla"
486,"Mortimer Beahan","2017-09-24 05:17:23","magni"
644,"Gonzalo Marquardt","2017-10-04 08:53:22","natus culpa sed"
296,"Mrs. Anahi Hilll","2018-03-23 07:32:59","Qui eos ab. Fugit voluptatem in doloribus praesentium. Cumque maiores temporibus modi. Neque impedit nobis et veniam velit veniam deleniti dolore et. Fugiat laborum optio reprehenderit saepe."
807,"Norwood Gutmann","2018-01-26 23:43:14","doloribus aut sit"
159,"Jade Pagac","2017-11-29 23:39:00","facere error sapiente"
320,"Vincent Heidenreich","2018-03-10 00:20:56","Omnis ducimus officiis et vero numquam laboriosam."
359,"Stone Stokes","2017-12-22 10:01:09","Atque eum et dolore sint. Nulla ab nihil rerum. Dolore et velit aut sed voluptatem. Modi ipsam et laboriosam ut qui. Ut ut doloremque sunt quisquam tenetur vel non beatae.
 Voluptas ullam voluptatibus dolore a quas consequatur qui aliquam dolores. Suscipit voluptate repudiandae fuga modi vel. Quisquam aliquid corporis. Est porro et unde quasi. Aperiam molestiae sed ratione. Omnis quia consectetur.
 Laborum beatae ut quibusdam optio velit. Voluptas neque itaque. Voluptatum voluptatem libero."
774,"Kristoffer Sauer","2017-09-01 10:06:18","Ut ut eum aut qui temporibus voluptas."
6,"Orion Koch","2018-02-23 20:52:07","Non autem ea dolores debitis sit et distinctio quae ad. Libero debitis nulla eius quia deserunt autem assumenda soluta. Impedit voluptate ducimus nihil id quia cupiditate."
15,"Kenny Vandervort IV","2018-03-08 11:20:30","Blanditiis vel sapiente doloremque corrupti voluptatem. Ut facilis provident itaque modi sed sequi. Placeat autem magni tenetur et vel aliquam aperiam omnis.
 Dolor eos recusandae doloribus harum. Velit reprehenderit voluptatum culpa voluptatem soluta autem iusto unde. Repudiandae id eaque aliquid voluptatem molestias nostrum consectetur eius ea. Possimus sapiente mollitia at laborum. Quia consequatur adipisci dolorum.
 Et qui velit esse ut maxime molestiae occaecati. Labore est quod architecto autem architecto iure. Error voluptas laboriosam iste necessitatibus aut."
483,"Beryl Towne DVM","2018-02-06 08:53:37","Inventore id repellat voluptatem omnis laudantium molestiae aut consequatur officiis. Quas laudantium corrupti possimus quo aut non aperiam eveniet minima. Laudantium consequatur adipisci alias."
139,"Nelle O'Conner","2018-04-11 17:45:28","doloribus"
377,"Linwood Rogahn","2018-06-26 03:44:22","Est debitis ut. Debitis eveniet nam aperiam alias quisquam iusto aliquid. Saepe id possimus rerum aut voluptates tenetur ex. Aut dolorem quod blanditiis iure delectus occaecati et. Ullam minus consequatur autem error repellat. Voluptatem ut illo ut vero harum fuga magni quibusdam aut.
 Autem sequi voluptatum incidunt ipsam dolor incidunt dolor perferendis. Sit sed tenetur porro officia molestiae. Ad dignissimos et provident facere dolores deserunt corporis velit. Rerum dolorem ut voluptas dolorem. Nulla quia earum necessitatibus. Rerum eveniet magnam enim sed vitae quisquam.
 Enim possimus quia consequatur. Est rem ex deserunt dolor libero. Et deserunt consequatur consequuntur a aliquid quo molestiae aliquam. Sequi fugit qui nobis autem quibusdam. Aliquam sed cupiditate aut delectus."
