"fk","vetName","date","note"
344,"Else Smith","2018-03-14 11:08:31","Aut at nisi animi. Quia et unde impedit doloribus possimus ut veniam aspernatur. Id est aut incidunt voluptatibus. Unde quia aliquam excepturi nihil voluptate. Qui odit non pariatur sit sunt debitis id et nihil. Porro corporis consectetur ullam voluptatum qui aliquam ea repudiandae.
 Esse reprehenderit autem esse et atque fuga dolor rerum sequi. Blanditiis officiis repellat iste impedit autem esse autem. At amet et laudantium perspiciatis aliquam sapiente. Excepturi quae facilis qui. Consequatur qui sint porro velit nesciunt. Temporibus quia consequatur veritatis est animi.
 Eum similique perspiciatis neque reiciendis sunt nostrum. Rem id id id officia rerum quo. Sint tenetur et. Provident eum tempore et. Qui ad consequuntur fugiat minus neque assumenda quia minus."
401,"Miss Leonor Macejkovic","2018-03-30 02:18:05","Excepturi temporibus quo id. Voluptatem illum sunt et dolorem voluptatum vitae eligendi ut. Incidunt perferendis provident veniam nobis aut itaque. Consequatur est officiis. Dignissimos repellat sunt. Distinctio nam recusandae voluptatum quas minima dicta officiis in."
269,"Dedric Franecki","2018-04-16 08:51:14","Aut dolor ut. Eum reprehenderit omnis rerum sed corrupti. Incidunt sint dolorem molestias dolor consectetur voluptate. Nesciunt est possimus tempora omnis ea similique. Aut in autem corporis illum quibusdam rerum atque iusto. Dolorem eius autem voluptas autem.
 Quas ullam magnam quae et non eius. Modi dolore itaque dicta et. Incidunt ea dolorum ab odio omnis. Nemo maxime fuga non magnam et enim. Vel dolores magnam ea explicabo at tenetur nihil commodi blanditiis.
 Ad voluptatem et saepe. Amet ipsum voluptas facere ipsum ut. Nemo itaque aut corrupti beatae eius. Quibusdam amet eos nihil."
260,"Liana Christiansen","2018-01-01 04:08:19","Enim autem autem totam aut illum sint mollitia officiis cum."
890,"Letitia Lockman","2017-09-15 23:45:34","quam"
498,"Dusty Hayes","2017-08-18 12:25:44","Consequatur dicta aliquam nihil odit voluptatem quam."
317,"Rickie Halvorson","2017-10-22 05:31:50","iusto"
540,"Edwina Carter","2017-08-27 03:44:49","eum rerum modi"
980,"Kareem Goldner","2018-06-02 23:05:40","optio dolore aut"
405,"Verona DuBuque","2018-04-19 22:11:35","Et quos reprehenderit rem consequatur.
Consequuntur voluptas magnam laborum suscipit quis et voluptas facilis optio.
Nihil labore vel aut recusandae.
Maxime rerum expedita voluptatem dolor.
Et impedit cum dolorem neque."
926,"Lizzie Turner","2018-03-06 11:38:29","sequi dolor labore"
391,"Jailyn Bergnaum","2017-10-17 13:01:40","Qui totam consequatur eligendi maxime tempore."
961,"Lourdes Cartwright II","2017-11-29 19:04:30","ut qui quia"
595,"Mr. Liliane DuBuque","2018-04-03 03:54:09","nisi"
330,"Bianka Lakin I","2018-02-11 19:30:59","Exercitationem asperiores neque voluptatem aut ducimus praesentium sit."
854,"Alexa Stokes","2017-12-24 21:06:38","Libero et atque animi ad architecto. Id debitis nesciunt cupiditate. Esse sunt libero quibusdam quisquam nostrum illo. Aut ut quis natus."
159,"Betsy Dibbert DVM","2018-01-29 17:03:13","Nesciunt repellendus consequuntur est architecto laborum.
Non sit voluptatem libero ipsam ullam sit ducimus iure quas.
Nostrum qui debitis molestiae commodi officia esse."
258,"Llewellyn Herzog","2017-08-30 03:21:15","Eum autem error dolor. Omnis ut vitae dignissimos voluptates aspernatur. Enim impedit laborum et et explicabo laborum ut maxime."
545,"Christy Dickens I","2018-02-19 14:32:11","Qui odit sapiente velit dolor."
34,"Dr. Lavinia Miller","2018-06-13 14:36:07","Quia tempora ut ut nemo tenetur dolor assumenda sunt."
598,"America Trantow","2018-03-04 15:17:21","Enim beatae sit incidunt corrupti earum aut aut quibusdam occaecati."
842,"Casandra Streich","2018-05-20 23:39:45","Perspiciatis quam vel cumque placeat est voluptates quod omnis. Eligendi occaecati quas at dolores itaque et ad nihil quos. Praesentium asperiores sed perferendis amet id laudantium eos. Quisquam sit officia non praesentium et. Repudiandae provident dolorem consequuntur accusantium nesciunt. Enim dicta adipisci maxime pariatur nobis sunt placeat laboriosam ut."
656,"Clarissa Graham","2018-07-05 02:13:02","Non ducimus voluptatum. Dolorem voluptates recusandae. Voluptatem est et deserunt nihil. Placeat et quasi veniam."
812,"Gerda Hirthe","2017-08-02 09:56:23","dolores nihil qui"
542,"Damien Romaguera","2017-11-30 10:01:19","Laborum ad vero nemo eveniet non consequatur qui eius.
Nobis et voluptatem recusandae magnam consequatur.
In aliquam eum velit."
759,"Felicita Gutkowski","2017-11-26 01:57:25","Maiores itaque ut eligendi. Esse at perspiciatis illum. Sed dolores corrupti eaque assumenda id autem qui possimus reprehenderit. Doloremque rerum vitae."
355,"Beau Breitenberg","2018-03-28 05:41:39","Culpa mollitia accusantium amet amet non ut itaque quia ipsa."
121,"Georgiana Prohaska MD","2017-10-23 01:46:52","Assumenda qui ad omnis.
Illum sit nemo libero tenetur.
Sunt odio voluptatem omnis consequuntur amet molestiae animi.
Cum accusamus quo unde voluptas veritatis illum."
208,"Amaya Harris","2018-03-14 01:30:28","Et aut ut molestiae sed id consequatur ut laborum a."
847,"Mrs. Lily Pollich","2018-01-29 18:14:16","Hic doloribus aut nobis deserunt ipsam ut est. Quo aut aspernatur. Ipsam temporibus magni consequatur rerum et quod consequatur. Facere aut dolor voluptates."
416,"Asha Cormier","2018-07-03 08:03:02","modi laudantium et"
81,"Jamel Leffler","2018-03-07 12:25:07","In qui rerum qui et."
610,"Armand Bogisich","2018-07-28 07:23:59","Et libero ut voluptas."
379,"Luella Walter","2017-10-24 04:42:13","Delectus non culpa tempora dolores voluptate reiciendis sed neque adipisci."
119,"Grayce Eichmann II","2018-05-13 04:51:47","voluptate sunt tempore"
891,"Eldon Feest","2017-10-31 07:45:41","Id ex dolor est aut consequatur et. Sint rerum fugiat minus molestiae. Et magni itaque provident sunt numquam culpa. Animi quod voluptatibus. Molestias est consequatur temporibus repellendus eos. Voluptate temporibus tenetur dicta nobis vel error."
720,"Macey Kub","2018-03-04 09:29:59","Sunt est et. Laudantium quas praesentium eius aut delectus nemo blanditiis est. Facere corrupti in. Inventore tempora inventore nisi ipsam."
242,"Shad Schamberger III","2017-09-26 00:07:22","Laudantium ut similique eius veniam aut."
883,"Marcos Yundt","2018-06-15 21:30:52","Et temporibus temporibus dolorem nesciunt aspernatur placeat. Earum quod autem natus qui perferendis corrupti facilis. Molestiae ut sunt est placeat hic. Quo et amet vel quis est cumque numquam voluptas. Expedita ut incidunt. Repellendus et atque quis."
141,"Mrs. Fannie Heathcote","2017-10-28 23:16:43","Nam provident voluptatem recusandae voluptatem ipsa quia libero sint itaque."
876,"Nova Lubowitz","2017-09-25 02:20:26","Totam dolor repudiandae quidem voluptas dolore ratione rerum officiis."
110,"Willie Smith","2018-04-12 21:21:48","Non reiciendis quas laborum asperiores est ut. Est rem corporis error error et perferendis. Et velit similique optio nulla maxime qui. Ut a ipsum. Itaque consectetur sed unde quia. Eius esse cupiditate consectetur doloribus ipsa."
31,"Demario O'Keefe","2018-07-13 20:16:15","Sed delectus mollitia aspernatur. Esse maxime qui maiores aut. Sit ut fuga nisi magnam expedita ipsam facilis alias soluta. Atque et unde autem. Quia nobis fuga fugit fuga."
578,"Leatha Volkman","2017-09-02 09:27:50","Culpa quaerat quo ex sunt. Eaque quisquam maxime repellendus corrupti vel laborum. Itaque deserunt nesciunt beatae impedit non repudiandae sed ex."
756,"Elinor Davis","2017-09-10 15:13:47","Aut commodi laudantium autem."
62,"Queen Auer","2017-10-01 17:11:33","Repudiandae numquam quisquam quas aut qui quia ea.
Commodi eum in aut fugiat."
925,"Orin Runolfsdottir","2018-03-03 04:49:10","Id quam qui culpa iure recusandae omnis aut eum culpa. Maiores cupiditate et rerum ut voluptatibus. Ab et sed commodi molestiae quis. Numquam consequatur iure in sit."
713,"Rosanna Littel","2017-09-25 18:27:35","Rerum et ea quo animi et quibusdam expedita. Rerum distinctio eos deserunt dolores et illo perspiciatis sit. Saepe id consequatur ipsam culpa ea ab quis. Iste placeat fugit culpa numquam et id."
203,"Miss Paula Ebert","2017-09-26 15:56:34","eligendi nobis esse"
581,"Daphney Treutel","2018-07-03 13:37:40","Sint quas quaerat sit delectus voluptatem ut id facilis. Veritatis ea quod reprehenderit laborum unde laborum voluptate harum. Quia qui ad magni fugiat voluptatibus autem. Tenetur voluptas quidem harum voluptatem delectus ipsum a dolorum nihil. Aut similique pariatur quia aliquid culpa est impedit."
498,"Mrs. Abdiel Daugherty","2018-03-15 06:28:30","Qui fugit quisquam explicabo velit. Cupiditate tenetur error qui commodi eum totam harum qui. Asperiores dolore in pariatur et quia voluptas id id. At dolores vitae."
338,"Judy Jerde","2018-05-06 00:31:25","Quae numquam est sequi."
977,"Lisandro Brakus","2018-04-01 14:20:53","Est et optio.
Adipisci fuga perspiciatis sequi.
Est minima voluptatem voluptatum similique voluptatem sint ut quae."
315,"Dejah Barrows","2017-10-03 16:06:13","Enim cupiditate quo dolorem quibusdam a. Aut pariatur excepturi magni aspernatur a voluptatem aut. Ut mollitia et laudantium voluptatem optio in sit voluptate. Non quam quis voluptatem architecto id iusto. Quia sit error quia illo recusandae perferendis praesentium corrupti. Qui veritatis explicabo cupiditate aperiam aperiam optio est voluptas."
670,"Henriette Rolfson","2018-07-04 03:23:58","delectus velit nam"
202,"Heaven Kulas","2017-11-21 17:52:16","Explicabo aspernatur officiis aut assumenda et repellat. Et sapiente eum enim. Et aliquam rerum a at rerum. Et provident at ducimus ipsum. Sit minus rerum corporis nostrum laborum. A et maxime."
736,"Shana Blanda","2018-01-05 02:07:01","est"
554,"Trevion Koepp","2017-11-21 10:28:07","Nemo quo fugit. Dolore beatae modi maxime modi. Ullam non deserunt qui eveniet in. Dolorum soluta sed et minima alias non. Commodi necessitatibus suscipit vel."
854,"Alfreda Mann","2018-02-16 12:35:00","quia adipisci facere"
662,"Arno Champlin","2017-12-30 13:34:24","Reiciendis eligendi non quo fugit quod voluptatem fuga sit quas."
509,"Doyle Sanford","2018-01-14 13:16:07","Ullam voluptates alias placeat quidem et quos cum modi modi. Totam labore et aliquid nisi modi. Rem consequatur at. Placeat repellat dolorem atque in quod nisi alias temporibus aut. Fugit est debitis illo ut fuga aut quidem deserunt. Ipsum laborum aperiam error."
864,"Ubaldo Hahn","2017-08-22 00:12:02","Quibusdam ea dolores excepturi expedita velit.
Consequatur asperiores aut.
Ab earum sunt cum explicabo in quisquam vero esse."
330,"Madelynn Barrows","2018-05-25 19:16:58","Enim illo aspernatur impedit distinctio error quod. Et harum quibusdam animi eligendi sint quis et."
617,"Darrel Stark","2018-05-10 07:32:40","Ad et quaerat cum eos suscipit. Enim ipsum saepe quis optio officiis commodi cupiditate beatae. Dolores debitis exercitationem ut pariatur. Ut qui quaerat tempora aut. Dicta recusandae minima laboriosam quia ullam sed quam ratione. Optio et molestiae et eos."
692,"Ms. Ulises Spencer","2018-03-03 08:42:59","Aliquam aliquid voluptas doloribus et expedita dolor. Laudantium quos sed vitae et deserunt. Voluptas nihil esse officia quasi ut consequuntur deserunt autem. Ut sunt vero nisi facilis."
476,"Mara Sauer","2017-09-15 13:35:42","Vel delectus est eius libero animi consequuntur debitis provident impedit.
Nihil ullam aliquam libero atque doloremque dignissimos eum quo.
Nemo consectetur sit fugiat consequuntur est laboriosam ratione consequuntur autem.
Incidunt cum aut vel commodi et porro quo voluptatem et."
406,"Wilbert Skiles","2018-01-05 05:59:43","ducimus temporibus ut"
749,"Blaise McCullough","2017-09-01 12:36:04","Vitae dolores numquam nam saepe alias quo odio modi laborum."
333,"Prince Dicki","2018-01-02 12:38:26","Nemo atque molestias unde architecto illum vitae est asperiores. Rerum explicabo architecto ratione ducimus accusamus saepe. Possimus impedit atque est eum et dolorum nesciunt vel sint. Suscipit debitis maxime est porro est consequuntur consequatur."
276,"Susanna McGlynn II","2018-02-05 18:59:20","Quo dolores labore ad.
Velit ut voluptatem odio dolorem ut qui.
Et nisi velit consequuntur eos.
Repudiandae dolorem amet dicta reiciendis exercitationem eveniet quasi."
432,"Grant Leffler","2017-12-23 10:42:59","accusamus"
937,"Dr. Margarett Wuckert","2017-12-12 16:10:42","Perspiciatis eos odit sint aspernatur in dolore quo. Voluptatem repellendus id consequatur voluptatem nihil ullam beatae. Omnis in ut rerum minus. Deleniti ullam impedit nostrum laboriosam dolores tempora beatae sit. Sit ratione fuga."
944,"Mallie Gislason","2018-02-11 07:28:34","Quos quo eius explicabo consequatur voluptas libero tenetur. Velit dignissimos et eum rerum perferendis facere dolores qui. Et quia ipsa fugit vel tempore aperiam asperiores amet. Eaque sed quasi minima molestias at fugit molestiae. Aut et amet culpa sit dignissimos ea mollitia asperiores. Aspernatur itaque quod iure itaque velit.
 Nemo esse optio omnis rerum maxime enim. Qui quasi aliquam nam. Et amet inventore. Eos molestias sed nostrum quos perspiciatis. Omnis eos quo minus et nesciunt quasi voluptatem.
 Cupiditate omnis consequatur ipsam voluptates dolorum. Quibusdam eos eum unde et perferendis. Quam voluptatum et neque doloribus porro ut odio. Ducimus voluptas odio et qui quam nihil. Quis aperiam eligendi."
268,"Josefina Frami","2017-09-04 18:02:31","Et velit aliquid nulla occaecati."
290,"Coby Kunde","2017-08-30 17:58:09","aut ex delectus"
78,"Mr. Nestor Jakubowski","2018-01-02 22:23:34","et"
326,"Ike Sporer","2017-12-24 18:20:32","Reiciendis libero dicta consequuntur inventore aut velit. In facere sunt libero consequatur doloremque vero sed. Nemo sint praesentium vel. Earum doloremque dicta velit asperiores quod vel. Tenetur dolorem non est perferendis consequatur. Aut et officia."
527,"Israel Terry","2018-01-24 01:18:25","Occaecati commodi dignissimos. A possimus recusandae in qui ut est nostrum iusto. Odit voluptas ipsa. Eos aperiam ut occaecati nulla modi consequuntur. Sit adipisci omnis.
 Atque sint molestiae totam qui iste dolorem. Quisquam repellat consequatur. Quo aut voluptatem explicabo.
 Eveniet voluptate sunt neque velit praesentium et dignissimos quasi. Quis cum maxime harum. Qui blanditiis soluta et exercitationem. Quam architecto iusto minima molestiae magni molestiae iusto autem illum. Enim fuga sunt. Maiores magni voluptatum neque suscipit voluptas."
48,"Dane Tromp","2018-04-05 01:22:13","Vitae laborum magni delectus earum aut quae recusandae nesciunt id.
Ab ipsum ut sed.
Est atque et.
Officiis tempora laudantium sed quae sed recusandae facere.
Voluptas delectus facere quis numquam velit repellendus id molestiae qui."
605,"Miss Maximo Kovacek","2017-08-02 00:00:56","Sunt atque ex. Veritatis saepe rerum ipsa non. Excepturi ea voluptas est. Et perspiciatis odio cupiditate et ratione et labore. Fuga ut ad eius nam eos cupiditate. Quos repudiandae illum ea."
739,"Eveline King","2017-11-22 07:22:27","Recusandae autem facere. Tenetur omnis officiis est. Quia laboriosam et beatae occaecati."
661,"Kiel Kautzer","2018-02-11 20:28:55","fuga"
112,"Louvenia Schiller","2018-03-15 19:16:11","Consequuntur voluptate natus ea molestiae."
31,"Beryl Macejkovic II","2017-10-27 16:41:14","Sit eum facilis. Et id facilis soluta temporibus quia nihil et quia error. Dolorem dolores porro culpa incidunt consectetur earum. Animi ad sequi qui."
913,"Giuseppe Goldner II","2018-07-25 03:43:19","Praesentium dolorum voluptatum. Quae aspernatur reiciendis vitae qui. Veritatis architecto nostrum nam nulla libero atque qui quis quibusdam."
609,"Virgil Moen","2017-12-21 04:01:08","Excepturi eos necessitatibus. Rerum quis ad eum sit. Quod adipisci sit nostrum quis iste animi et.
 Vero numquam sit veritatis incidunt dolor. Dolorem nobis optio distinctio rerum aut eos. Soluta reprehenderit et eum cumque nobis omnis dolor dolore et. Eveniet amet saepe quae consequatur et. Atque est est sed nobis ipsum. Incidunt accusantium pariatur cupiditate aut magnam adipisci.
 Sit ex tenetur et in. Et dignissimos recusandae et corrupti. Est nihil vitae repudiandae illum similique impedit id. Amet necessitatibus natus vitae odio eos pariatur inventore accusantium. Consequuntur ratione dicta atque aut neque accusantium perferendis voluptas et. Rerum praesentium sapiente odit accusantium."
528,"Laverne Fritsch","2018-04-29 04:01:53","Aspernatur in est est animi quasi ipsum vel. Corrupti quos in vel et ullam eligendi laboriosam. Omnis quibusdam dolorem deserunt quidem ut sed ipsum. Totam soluta voluptas ut saepe laborum."
905,"Mrs. Jeremie Tromp","2017-11-13 13:22:47","velit aliquam sit"
262,"Valentine Wintheiser","2017-09-01 19:10:33","Totam eius aut illum laudantium facilis ut sint. Et quia quibusdam rerum ut ducimus. Officia iste quod dolores exercitationem culpa. Ex provident consequatur voluptas dolor maxime voluptatem et in."
226,"Carey Hane","2018-02-27 05:14:45","Fugit autem et non eos est ut velit sunt. Expedita vero quia repellendus quae laborum officiis. Voluptatem quibusdam porro illum illum voluptas quidem quo cupiditate. Cupiditate repellendus iste. Ab repellendus dolore dolores omnis accusamus maxime non. Perspiciatis rerum commodi occaecati."
497,"Elvie Romaguera","2018-04-25 09:00:26","non"
270,"Jedediah Tillman Jr.","2018-07-01 18:12:27","Hic voluptatem voluptatem est aut a optio sapiente cumque. Consequatur iusto quasi nemo adipisci est provident. Doloribus rem ipsum tempora non.
 Quia distinctio voluptatum consequatur nesciunt amet. Illum adipisci illum soluta tenetur et ut quia nesciunt. Et rerum repellendus officia pariatur aut fugit corporis.
 Ea quas eos soluta ratione et iusto. Architecto at ut maiores reiciendis sunt vel aliquid. Beatae eius autem ducimus molestiae perferendis."
291,"Loraine Donnelly","2018-02-23 10:10:00","Ut vel ut consectetur incidunt hic consequatur qui. Tempora amet deserunt sed sed et voluptate. Necessitatibus ea aspernatur.
 Necessitatibus recusandae occaecati eaque distinctio omnis dolore. Necessitatibus et dolorem doloribus sint quis aut maxime ut. Eligendi nobis adipisci id. Odio doloribus deleniti quasi autem corrupti quis.
 Et debitis expedita culpa autem sunt dignissimos. Modi corporis provident est et dicta. Eaque iure saepe magnam. Vel eos blanditiis. Eius aperiam et voluptas id non natus temporibus velit ducimus."
994,"Alf Willms","2017-09-01 07:34:02","Vel eveniet labore officia non."
380,"Maurice Beatty I","2018-03-28 05:48:11","Blanditiis architecto dolores et praesentium. Qui nihil et rem mollitia similique ipsam quo et. Quo accusantium laudantium est eius earum commodi maiores qui. Rerum pariatur minima et neque molestias iusto aut exercitationem rem."
117,"Miss Karlee Mann","2017-10-15 00:09:00","Dolore dolore at in non quis est.
Saepe dolores ea dicta iusto debitis."
512,"Adriana Stamm","2017-08-22 01:59:35","repudiandae"
361,"Heaven Kulas","2017-12-02 03:08:41","Aut impedit maiores.
Nostrum nisi porro qui voluptatem aut quis numquam.
Nulla et in sit.
Deserunt ut et et.
Eos at ut quo laboriosam."
802,"Alexis Stroman II","2018-05-09 10:20:42","Quo suscipit doloremque aut quos et distinctio rerum sint. Mollitia nihil rem cum quia expedita quia et laboriosam et. Tempora delectus nemo eum placeat assumenda.
 Et nobis sit repellendus molestias odit omnis atque ea. Incidunt qui ea voluptas et vel. Laborum velit rerum inventore illo in. Officia quaerat adipisci enim eum eius in et non. Aperiam molestias excepturi dolore officia enim tempore enim eligendi incidunt. Et laboriosam velit asperiores sed expedita sit et dolorum maxime.
 Eveniet itaque officia quas deleniti est id. Corrupti quis ea expedita vel minima omnis iure occaecati consequatur. Harum est voluptatibus alias beatae exercitationem. Tenetur repellendus doloribus quis at dolores sed non. Beatae et et eius nihil. Accusamus voluptatem iure eum est."
537,"Shyann Becker","2017-08-15 21:24:15","Qui id eligendi voluptatem sunt recusandae dolor optio expedita ut. Non est itaque voluptatum enim voluptatem. A dignissimos in id sapiente illum nobis vel est dolorum.
 Quasi ea amet cumque ab magnam ipsa aut vero. Sit aut in asperiores aut sint eum itaque optio. Quidem quisquam mollitia aut eveniet ab animi nihil eaque. Laboriosam ducimus aut et sit alias ipsum perferendis. Itaque dignissimos id sapiente aliquam incidunt provident necessitatibus est. Consequatur est ut excepturi voluptates et pariatur quibusdam adipisci.
 Officiis eaque ducimus consectetur omnis. Quia iusto eos error natus quis libero aut laboriosam quis. Corporis natus voluptas explicabo dolorum officiis similique aut ad. Molestias odio cum ut sapiente non. Assumenda ea nulla voluptatem omnis voluptatem reiciendis veniam officia."
20,"Blaise Kuvalis","2018-03-28 22:13:45","Sit doloremque minima et nostrum. A ut sunt odio ut. Sed est optio nihil asperiores ducimus. Et eum ut. Est provident et et soluta. Doloremque voluptas ratione reprehenderit natus officia nihil.
 Esse rerum nemo ut ad est repellendus. Sit explicabo dolor. Et rem dolorem. Quaerat quaerat itaque est soluta occaecati. Amet magnam rem dignissimos. Odio ab vel a et quia quia expedita.
 Non magni quisquam a eum ea saepe itaque molestiae deserunt. Deserunt nesciunt iusto neque non a atque quae doloribus. Minus dolorem ut dolores ut consequatur assumenda reiciendis. Atque quos repellat corporis aut dolores omnis. Deleniti sint consequatur quia iure consequuntur molestias consequatur quae recusandae. Repudiandae qui aperiam ipsam ullam quis rerum voluptatum necessitatibus."
374,"Selmer Stark","2018-03-07 05:06:04","Accusantium iure est tempore autem fuga quia. Libero ut et. Similique possimus libero et deserunt cum dolore facilis molestias."
637,"Matilda Reilly","2018-03-30 19:49:03","quasi officiis qui"
760,"Caleigh Berge","2018-05-24 17:59:57","Rerum optio laborum error ut amet. Eos et vel. Illum dicta rerum accusamus quae officia aut eos. Odio eum fugiat incidunt quia laboriosam quos.
 Ea rerum animi libero quia possimus molestias omnis. Aut voluptate quod ratione nisi voluptas exercitationem animi aperiam. Optio ea architecto. Natus eos autem. Nulla sequi accusantium et animi aut aperiam tenetur. Ipsa a necessitatibus error qui error natus.
 Saepe dolores expedita libero. Fuga eos facilis ut dignissimos quis ut eos. Sed quidem et consequuntur. Et dolore magni autem omnis commodi eum autem cumque magni. Maiores commodi in. Soluta quidem voluptate ea sed tempora ducimus odio expedita."
586,"Mr. Demario Parker","2018-01-22 11:43:40","Eos sunt reiciendis iste repellendus quo rem."
319,"Mr. Earnest Mann","2017-12-15 02:58:30","Dolorem rerum ut delectus harum doloribus.
Qui omnis eum odio consequatur nemo eum quia.
Iste quis ipsa eum velit ducimus.
Saepe suscipit ullam delectus aut aspernatur aut."
271,"Evans Mitchell II","2017-09-19 20:59:53","Est molestiae non placeat et tempora delectus quo."
945,"Kurtis Erdman","2018-04-01 12:05:51","ad"
949,"Florencio Sauer","2017-08-14 14:15:00","Sed ut explicabo est expedita unde libero hic pariatur. Quos nulla non sed quidem maiores asperiores asperiores debitis ea. Accusamus exercitationem optio quia unde. Officiis enim quo omnis reprehenderit aut sint. Eveniet enim nesciunt et possimus itaque consequuntur rerum."
810,"Mrs. Jedediah Strosin","2017-09-03 00:09:58","aut at rerum"
487,"Rod Hagenes","2018-04-11 06:13:45","Quisquam esse maiores. Quia ut quibusdam et rerum dicta. Qui libero ipsum consectetur fugiat dicta delectus corporis. Rerum ut voluptatum quos et iste natus. Blanditiis labore vel quaerat laudantium voluptates. Voluptatem laboriosam numquam recusandae amet odio.
 Dolor quae non doloremque et nemo. Rem vel sit quod eos enim omnis consequuntur porro. Ut cupiditate hic dolor debitis excepturi.
 Excepturi repellendus soluta aliquam ut a non quam aliquam laborum. Provident vel fuga enim illum fuga expedita quasi. Qui ullam aut et vel. Rerum enim iure ex quia similique aspernatur sit aut. Corporis itaque eius. Iure doloribus iusto quo."
234,"Manuel Nicolas","2017-12-23 05:52:14","Voluptate rerum quidem aut porro optio. Ab qui aspernatur et dolorum iste quae cumque occaecati. Ut eius sint consequuntur quae sequi neque fuga fugiat nostrum. Reiciendis alias a quasi praesentium. Ut non alias eaque minus exercitationem aliquam nihil. Eaque perferendis culpa nesciunt perferendis."
73,"Mrs. Jermey Keeling","2018-06-26 02:46:30","est"
245,"Glenna Murphy","2017-09-28 10:25:54","Aut qui nobis eligendi iste tenetur et magni."
84,"Roderick Schulist","2017-10-18 04:38:29","Aut et numquam inventore voluptatem consequuntur architecto unde reprehenderit sunt."
856,"Paolo Becker","2017-11-18 09:53:19","Ducimus nam similique harum autem. Rem nihil voluptates eos dolor incidunt eveniet. Est quaerat quia voluptatibus et sapiente dolores voluptates aut numquam."
230,"Betty Huels","2017-12-13 19:06:22","sit soluta consequuntur"
740,"Eloise Yost","2018-01-21 07:07:38","rerum est molestias"
435,"Mrs. Aaron Davis","2017-08-03 23:42:09","est suscipit quos"
536,"Jedidiah Graham","2017-11-30 08:19:31","Dolor dolorem sit aliquid quos tempora animi voluptatum ipsum tempora. Labore corporis asperiores et minima quos eligendi esse. Cumque id eum at recusandae tenetur quae. Officiis exercitationem ipsam excepturi iste et facilis id deleniti et. Et sit eos.
 Quibusdam et facilis mollitia ex ut asperiores. Sunt nobis harum. Et pariatur deleniti velit amet.
 Ea adipisci aut accusamus sapiente libero vel iusto. Eius quo consequatur. Voluptatum dolor maiores eveniet pariatur."
194,"Katlynn D'Amore","2017-12-02 13:01:50","possimus ipsam voluptatem"
